|author|contents|date|tags|title|tweetid|url
3512|||Wed Sep 17 12:40:16 +0000 2014||India's Ranbaxy says U.S. authorities seek information on pricing data |5.122194832396329e+17|http://reut.rs/1mdY05r
3513|||Wed Sep 17 12:40:15 +0000 2014||Auxilium Pharma backs QLT deal, adopts poison pill after Endo's bid |5.122194817087201e+17|http://reut.rs/1o2R3je
3514|||Wed Sep 17 12:23:30 +0000 2014||For Roche CEO, celebrating failure is key to success |5.122152665044992e+17|http://reut.rs/1o2Oyxv
3515|||Wed Sep 17 11:36:40 +0000 2014||Auxilium Pharma adopts poison pill after Endo's unsolicited bid |5.122034795791319e+17|http://reut.rs/1o2ICV9
3516|||Wed Sep 17 10:42:14 +0000 2014||Gilead's experimental cancer drug fails in mid-stage study |5.121897797281505e+17|http://reut.rs/1o2BQP6
3517|||Wed Sep 17 05:45:20 +0000 2014||Sanofi unveils heart disease partnership with MyoKardia |5.121150644854661e+17|http://reut.rs/1o25oN1
3518|||Wed Sep 17 04:26:15 +0000 2014||Food companies' U.S. calorie-cutting pledge could stall: researchers |5.12095162949206e+17|http://reut.rs/1mcTjsv
3519|||Wed Sep 17 02:47:15 +0000 2014||GAO report warns of security risks in U.S. healthcare website |5.120702474077102e+17|http://reut.rs/1o1NOsf
3520|||Wed Sep 17 01:23:59 +0000 2014||Citing security threat, Obama expands U.S. role fighting Ebola |5.12049291234644e+17|http://reut.rs/1mcv1z1
3521|||Tue Sep 16 23:51:39 +0000 2014||U.S. leaders call for 'war' on Ebola outbreak, pledge troops |5.120260560026378e+17|http://reut.rs/1o1twiy
3522|||Tue Sep 16 22:39:41 +0000 2014||Urine test for cervical cancer virus offers alternative to smear |5.120079443520717e+17|http://reut.rs/1o1l7f4
3523|||Tue Sep 16 22:17:06 +0000 2014||Dispute could delay Florida rollout of limited medical marijuana |5.1200226216484045e+17|http://reut.rs/1mc4wtj
3524|||Tue Sep 16 21:16:23 +0000 2014||American waistlines still expanding, study says |5.119869828690125e+17|http://reut.rs/1qKMzUi
3525|||Tue Sep 16 21:00:33 +0000 2014||Post-immunization epilepsy likely not related to vaccine: study |5.119829984522076e+17|http://reut.rs/1qKJe7r
3526|||Tue Sep 16 20:45:16 +0000 2014||Obama says Africa Ebola epidemic 'spiraling out of control' |5.119791508787282e+17|http://reut.rs/1qKFW4f
3527|||Tue Sep 16 20:08:53 +0000 2014||Fewer hospitalizations for diabetic veterans using VA’s home-based care |5.11969994260095e+17|http://reut.rs/1qKxAtx
3528|||Tue Sep 16 19:21:40 +0000 2014||Coke, J&amp;J join big corporations behind new employee wellness push |5.119581129754542e+17|http://reut.rs/1o0XLq7
3529|||Tue Sep 16 19:05:46 +0000 2014||U.N. Security Council eyes action to heighten Ebola response |5.1195411327041126e+17|http://reut.rs/1qKjfxd
3530|||Tue Sep 16 18:59:19 +0000 2014||A serious children's respiratory illness has spread to a dozen U.S. states, and more are predicted, the CDC says: |5.119524879943721e+17|http://reut.rs/Xdn40r
3531|||Tue Sep 16 18:52:14 +0000 2014||RT @specialreports: Following @Reuters investigation, U.S. lawmakers want to curb antibiotic use on farms  http://t.c…|5.11950706971263e+17|http://reut.rs/1uE9Lng
3532|||Tue Sep 16 18:27:37 +0000 2014||Weight loss on antipsychotics is possible: study |5.1194451110764544e+17|http://reut.rs/XddKd0
3533|||Tue Sep 16 18:11:45 +0000 2014||World Bank approves $105 million Ebola grant for West Africa |5.119405165657784e+17|http://reut.rs/1o0PhPD
3534|||Tue Sep 16 17:26:51 +0000 2014||Children's respiratory illness spreads to a dozen U.S. states: CDC |5.11929216733311e+17|http://reut.rs/1qJXmxN
3535|||Tue Sep 16 17:26:50 +0000 2014||Roche's $8 billion InterMune buy not a signal for more big deals |5.119292149842821e+17|http://reut.rs/1o0JhXb
3536|||Tue Sep 16 16:57:21 +0000 2014||U.S. lawmakers want to curb antibiotic use on farms |5.1192179562541056e+17|http://reut.rs/1qJQgto
3537|||Tue Sep 16 14:46:49 +0000 2014||FDA approves AstraZeneca, Nektar constipation drug |5.118889455722455e+17|http://reut.rs/1qJknRJ
3538|||Tue Sep 16 11:06:22 +0000 2014||Northwest Bio drug gets first slot under UK early access scheme |5.118334658229248e+17|http://reut.rs/1qIxiTN
3539|||Tue Sep 16 10:25:45 +0000 2014||Study shows Novo's new diabetes drug effective and safe for children |5.118232451261522e+17|http://reut.rs/1nZKIVM
3540|||Tue Sep 16 10:25:45 +0000 2014||Switzerland takes on its top drugmakers in price row |5.118232434358477e+17|http://reut.rs/1qIpt0p
3541|||Tue Sep 16 10:10:00 +0000 2014||Merck KGaA agrees to market Lupin drugs in emerging countries |5.118192795291771e+17|http://reut.rs/1qImxRo
3542|||Tue Sep 16 08:28:31 +0000 2014||Hunger easing globally but 1 in 9 people undernourished: report |5.117937430167593e+17|http://reut.rs/1nZxU1I
3543|||Tue Sep 16 06:49:39 +0000 2014||AstraZeneca to partner with Eli Lilly on Alzheimer's drug |5.117688596288307e+17|http://reut.rs/1qHL9K8
3544|||Tue Sep 16 04:12:05 +0000 2014||Obama to ramp up U.S. response to Ebola with military mission |5.117292082600673e+17|http://reut.rs/1nZ6xVu
3545|||Tue Sep 16 01:43:29 +0000 2014||NY attorney general sues Actavis and Forest Labs over Alzheimer's drug |5.1169181405600154e+17|http://reut.rs/1nYR6fW
3546|||Tue Sep 16 00:42:48 +0000 2014||Lawyer grills DePuy executive over safety studies for Pinnacle hips |5.1167654164719206e+17|http://reut.rs/1nYKw9g
3547|||Mon Sep 15 21:53:52 +0000 2014||End 'panic' measures undermining fight against Ebola: Ghana |5.116340273891492e+17|http://reut.rs/1nYrjV4
3548|||Mon Sep 15 21:36:01 +0000 2014||U.S. says 115,000 could lose Obamacare insurance over immigration |5.116295344758661e+17|http://reut.rs/1nYoXWr
3549|||Mon Sep 15 21:36:00 +0000 2014||Chiropractic care may ease back-related leg pain |5.116295327939297e+17|http://reut.rs/1nYoXWt
3550|||Mon Sep 15 21:20:22 +0000 2014||To treat urinary incontinence, start conservatively, doctors say |5.116255974462751e+17|http://reut.rs/1qG7IPs
3551|||Mon Sep 15 21:13:48 +0000 2014||RT @specialreports: Rise of the Superbugs: How antibiotic resistant bacteria evolve &amp; infect people @Reuters  http://…|5.116239426088141e+17|http://reut.rs/1tW5GMa
3552|||Mon Sep 15 20:46:32 +0000 2014||New York City needs to step up nail salon inspections: watchdog |5.116170814992056e+17|http://reut.rs/1qG0FGd
3553|||Mon Sep 15 20:46:31 +0000 2014||Parents' whooping cough vaccines may protect babies |5.116170794775593e+17|http://reut.rs/1nYi0og
3554|||Mon Sep 15 20:30:55 +0000 2014||Epirus, Ranbaxy win India approval for arthritis drug copy |5.1161315136506266e+17|http://reut.rs/1qFX8Ia
3555|||Mon Sep 15 19:52:42 +0000 2014||Dozens of Illinois students treated in suspected carbon monoxide leak |5.116035332513587e+17|http://reut.rs/1nY9ZQ5
3556|||Mon Sep 15 19:01:51 +0000 2014||RT @ReutersUS: Pervasive use of farm antibiotics fuels concerns about impact on human health:  http://pbs.twimg.com/media/BxmCQ3HIgAAf-6b.jpg|5.115907376629801e+17|http://reut.rs/1wwQMwT
3557|||Mon Sep 15 18:40:48 +0000 2014||Merck says osteoporosis drug achieves goal in large trial |5.115854414943396e+17|http://reut.rs/1nY0hgF
3558|||Mon Sep 15 17:57:31 +0000 2014||Painkillers, sedatives biggest threat when kids get into medicine chest |5.115745477418271e+17|http://reut.rs/1qFmEgC
3559|||Mon Sep 15 17:12:56 +0000 2014||RT @ReutersTech: Two Apple medical trials shed light on how HealthKit will work. A Reuters exclusive:  http://t.co/Sx…|5.115633291739873e+17|http://reut.rs/1saNFE3
3560|||Mon Sep 15 15:47:00 +0000 2014||As Ebola grows out of control, WHO pleads for more health workers |5.115417011573473e+17|http://reut.rs/1qEPnSD
3561|||Mon Sep 15 15:20:36 +0000 2014||RT @Reuters: Low doses of antibiotics are standard diet for chickens but what are the risks to humans?  http://t.co/S…|5.115350575559516e+17|http://reut.rs/1y6HGIZ
3562|||Mon Sep 15 15:06:02 +0000 2014||RT @specialreports: Confidential “feed tickets” shed new light on poultry industry use of antibiotics  http://t.co/2w…|5.1153139158708634e+17|http://reut.rs/1tW5GMa
3563|||Mon Sep 15 13:22:15 +0000 2014||RT @specialreports: Special Report: The drugs fed to poultry and the risks posed to humans @Reuters  http://t.co/THFB…|5.115052765627187e+17|http://reut.rs/1tW5GMa
3564|||Fri Sep 12 19:40:05 +0000 2014||Community music lessons helpful for at-risk kids |5.105131962689413e+17|http://reut.rs/1qODSqZ
3565|||Fri Sep 12 18:43:27 +0000 2014||Roche says vials of counterfeit MabThera found in Germany |5.104989432563794e+17|http://reut.rs/1qOsJq4
3566|||Fri Sep 12 18:16:11 +0000 2014||Stints of standing while working may reduce back pain |5.104920806578012e+17|http://reut.rs/1rUGq2R
3567|||Fri Sep 12 16:13:05 +0000 2014||U.S. seeks to hold Bayer in contempt over product health claims |5.104611033823355e+17|http://reut.rs/1qNXUlt
3568|||Fri Sep 12 15:13:51 +0000 2014||Lilly stomach cancer drug prolongs life in colon cancer study |5.104461976899461e+17|http://reut.rs/1qNLkCK
3569|||Fri Sep 12 12:32:03 +0000 2014||Merck KGaA ends lung cancer vaccine trials |5.104054800033014e+17|http://reut.rs/1rSWwdj
3570|||Fri Sep 12 10:57:05 +0000 2014||U.S. FDA panel: Novo Nordisk's liraglutide safe, effective for obesity |5.103815768535368e+17|http://reut.rs/1qMWqYL
3571|||Fri Sep 12 10:54:04 +0000 2014||As Big Tobacco takes up e-cigarettes, investors look ahead |5.103808182717153e+17|http://reut.rs/1qMVYK2
3572|||Fri Sep 12 08:53:04 +0000 2014||Ebola cases rising faster than ability to contain them: WHO |5.1035036900880384e+17|http://reut.rs/1qMD6uG
3573|||Fri Sep 12 08:34:05 +0000 2014||Cuba to send 165 health workers to fight Ebola in Africa |5.103455935420457e+17|http://reut.rs/1rRRwG7
3574|||Fri Sep 12 06:47:33 +0000 2014||BAT nicotine inhaler licensed as medicinal product in UK |5.1031878267426e+17|http://reut.rs/1rRpPgs
3575|||Thu Sep 11 22:23:34 +0000 2014||Health developers, doctors want to see more from Apple's watch |5.101919488632709e+17|http://reut.rs/1qKWEQ6
3576|||Thu Sep 11 21:13:38 +0000 2014||Seattle court orders HIV-positive man to stop spreading the virus |5.101743511952548e+17|http://reut.rs/1qKJJ0x
3577|||Thu Sep 11 21:13:37 +0000 2014||Third U.S. Ebola patient showing 'remarkable improvement' |5.101743453148447e+17|http://reut.rs/1qKJJ0t
3578|||Thu Sep 11 21:13:35 +0000 2014||Exclusive : Microsoft co-founder Allen to give $9 million for Ebola fight |5.1017433742117274e+17|http://reut.rs/1rPiwpz
3579|||Thu Sep 11 20:21:05 +0000 2014||U.S. FDA panel: Novo Nordisk's liraglutide safe/effective for obesity |5.101611280185467e+17|http://reut.rs/1rP4LXT
3580|||Thu Sep 11 20:21:04 +0000 2014||Sleeping seven to eight hours a night linked to taking fewer sick days |5.1016112327059046e+17|http://reut.rs/1qKA4ag
3581|||Thu Sep 11 19:47:34 +0000 2014||Most online CPR videos don’t match guidelines: study |5.10152691134124e+17|http://reut.rs/1rOUYkL
3582|||Thu Sep 11 18:46:33 +0000 2014||Breastfeeding tied to fewer ear, sinus infections in children |5.101373358500987e+17|http://reut.rs/1rOEngP
3583|||Thu Sep 11 17:44:04 +0000 2014||Exclusive: Akorn eyes $2 billion UCB unit in potential tax inversion - sources |5.1012161028870554e+17|http://reut.rs/1rOmmzk
3584|||Thu Sep 11 17:10:07 +0000 2014||RT @ReutersLive: TEDMED 2014: Health professionals convene to discuss the future of health and medicine. Watch LIVE: |5.10113065958785e+17|http://reut.rs/1pc5tgq
3585|||Thu Sep 11 16:59:03 +0000 2014||Scientists 'reset' stem cells to study start of human development |5.101102840530944e+17|http://reut.rs/1rO815L
3586|||Thu Sep 11 16:01:10 +0000 2014||Teens see different consequences from alcohol and pot: study |5.1009571580504474e+17|http://reut.rs/1qJIhLX
3587|||Thu Sep 11 15:32:03 +0000 2014||IMF says Ebola hits economic growth in West Africa |5.100883907047711e+17|http://reut.rs/1rNEYPR
3588|||Thu Sep 11 15:05:34 +0000 2014||What cancer patients want and what Medicare covers may differ |5.1008172246185574e+17|http://reut.rs/1qJwVHB
3589|||Thu Sep 11 14:28:42 +0000 2014||Long-awaited diet pill gets U.S. approval |5.10072445336703e+17|http://reut.rs/1qJp3pJ
3590|||Thu Sep 11 14:06:07 +0000 2014||Long-awaited diet pill Contrav finally gets FDA approval: |5.100667614382244e+17|http://reut.rs/1CVSSbg
3591|||Thu Sep 11 12:38:35 +0000 2014||Cancer-zapping proton therapy only suitable for rare patients |5.100447327522939e+17|http://reut.rs/1qJ4t8P
3592|||Thu Sep 11 12:03:06 +0000 2014||U.S. hearing aid sales dip in August |5.10035804232491e+17|http://reut.rs/1rMBxsC
3593|||Thu Sep 11 12:03:05 +0000 2014||Man tied to deadly 2012 U.S. meningitis outbreak due in court in Boston |5.1003580104902656e+17|http://reut.rs/1qIYgd8
3594|||Thu Sep 11 12:03:04 +0000 2014||Nigeria checking South African national as suspected Ebola case |5.100357976222884e+17|http://reut.rs/1qIYdxX
3595|||Thu Sep 11 10:01:06 +0000 2014||Ebola highlights slow progress in war on tropical diseases |5.1000510051794534e+17|http://reut.rs/1qIE22Z
3596|||Thu Sep 11 09:45:05 +0000 2014||Ebola highlights slow progress in war on tropical diseases |5.100010706726011e+17|http://reut.rs/1qIBFgQ
3597|||Thu Sep 11 07:38:34 +0000 2014||Missouri lawmakers override Governor's veto on '72-hour' abortion law |5.0996923199195955e+17|http://reut.rs/1rLnUtG
3598|||Thu Sep 11 05:32:33 +0000 2014||Sanofi aims to grow Genzyme unit with new drugs and acquisitions |5.0993751990798336e+17|http://reut.rs/1rKSuUh
3599|||Thu Sep 11 01:35:03 +0000 2014||Long-awaited diet pill gets U.S. approval |5.098777500735242e+17|http://reut.rs/1rJZdxY
3600|||Thu Sep 11 00:27:04 +0000 2014||Nebraska Ebola patient showing more progress : hospital |5.0986064230025626e+17|http://reut.rs/1rJJHC9
3601|||Thu Sep 11 00:27:03 +0000 2014||Economic growth forecasts cut for Ebola-hit West African nations |5.098606384708526e+17|http://reut.rs/1rJJG16
3602|||Wed Sep 10 21:41:03 +0000 2014||U.S. FDA okays expanded use of Medivation prostate cancer drug |5.0981886407122944e+17|http://reut.rs/1qGCEy2
3603|||Wed Sep 10 21:25:05 +0000 2014||Avoiding 'not tonight honey, I have a backache': study |5.098148438182748e+17|http://reut.rs/1qGzEl8
3604|||Wed Sep 10 20:57:05 +0000 2014||Cleveland Clinic to issue rare century bond |5.0980779625089024e+17|http://reut.rs/1rITubF
3605|||Wed Sep 10 20:57:04 +0000 2014||Race and poverty tied to thyroid surgery outcomes |5.098077918887936e+17|http://reut.rs/1qGucPm
3606|||Wed Sep 10 19:02:09 +0000 2014||What cancer patients want and what Medicare covers may differ |5.0977887307288576e+17|http://reut.rs/1qG8x9N
3607|||Wed Sep 10 18:10:05 +0000 2014||Oregon girl, 4, dies of E.coli, Washington state boy hospitalized |5.097657705705144e+17|http://reut.rs/1qFXLAt
3608|||Wed Sep 10 16:53:12 +0000 2014||Online co-parenting course can help divorcing couples |5.097464222964941e+17|http://reut.rs/1qFIf7O
3609|||Wed Sep 10 13:45:14 +0000 2014||FDA staff: NPS drug effective; no significant safety imbalance |5.096991214861025e+17|http://reut.rs/1rGKN1E
3610|||Wed Sep 10 13:29:16 +0000 2014||FDA staff: NPS drug effective; no significant safety imbalance |5.096951024914391e+17|http://reut.rs/1rGFQ92
3611|||Wed Sep 10 12:32:10 +0000 2014||Lilly, Boehringer copy of Sanofi's insulin gets EU approval |5.096807313253335e+17|http://reut.rs/1rGmWiB
3612|||Wed Sep 10 10:35:04 +0000 2014||Guinean who brought Ebola to Senegal recovers from virus |5.0965126240128614e+17|http://reut.rs/1rFOyEv
3613|||Wed Sep 10 10:19:04 +0000 2014||Ebola death toll rises to at least 2,296 : WHO |5.0964723777367245e+17|http://reut.rs/1qEqHZJ
3614|||Tue Sep 09 23:55:03 +0000 2014||Liberia president urges more international help fighting Ebola |5.0949019854821376e+17|http://reut.rs/1rDgw3B
3615|||Tue Sep 09 23:39:33 +0000 2014||Daily cannabis smokers risk health, wellbeing and achievement |5.094862970611384e+17|http://reut.rs/1rDcQyQ
3616|||Tue Sep 09 22:33:36 +0000 2014||A high-soy diet may drive breast tumor growth : study |5.094697006993367e+17|http://reut.rs/1rCWqXn
3617|||Tue Sep 09 22:17:33 +0000 2014||West Nile virus outbreak hits California's Orange County |5.094656622053458e+17|http://reut.rs/1rCSg1z
3618|||Tue Sep 09 21:28:04 +0000 2014||Drug use up among U.S. pilots killed in crashes : government study |5.094532058690437e+17|http://reut.rs/1qCno52
3619|||Tue Sep 09 20:50:25 +0000 2014||Stroke less likely for older women who get more potassium |5.0944373247563776e+17|http://reut.rs/1rCtYVk
3620|||Tue Sep 09 20:05:33 +0000 2014||Sheets, towels, TV remotes key reservoirs for MRSA contamination |5.094324417490002e+17|http://reut.rs/1rChrRX
3621|||Tue Sep 09 19:17:15 +0000 2014||Sodium conundrum: Nine in 10 U.S. children eat too much salt |5.094202847643853e+17|http://reut.rs/WO719t
3622|||Tue Sep 09 16:23:05 +0000 2014||Web cam used to detect abnormal heart rhythm |5.0937645643085005e+17|http://reut.rs/1qBq9Um
3623|||Tue Sep 09 15:26:03 +0000 2014||Ebola death toll rises to at least 2,296: WHO |5.093621034806272e+17|http://reut.rs/1rAXB9C
3624|||Tue Sep 09 14:14:48 +0000 2014||RT @ReutersOpinion: .@StevenBrill asks: How much money is raised and spent in fighting cancer? |5.093441718747218e+17|http://reut.rs/1p2Mapx
3625|||Tue Sep 09 13:20:33 +0000 2014||Senegal tracks route of Guinea student in race to stop Ebola |5.0933052159625626e+17|http://reut.rs/1qALkWE
3626|||Tue Sep 09 12:11:15 +0000 2014||Fourth Ebola patient to arrive in U.S. for care |5.0931308008638054e+17|http://reut.rs/1qAxkMG
3627|||Tue Sep 09 11:35:08 +0000 2014||Suspected Ebola case investigated in Italy |5.093039916293898e+17|http://reut.rs/1rzKAwX
3628|||Tue Sep 09 00:09:33 +0000 2014||U.S. government spending bill to contain new funds to fight Ebola |5.091314583974707e+17|http://reut.rs/1rx6XTP
3629|||Mon Sep 08 22:38:34 +0000 2014||Another Ebola patient coming to Atlanta hospital |5.0910856320608666e+17|http://reut.rs/1rwLzxZ
3630|||Mon Sep 08 22:07:04 +0000 2014||Starbucks goes coconuts in latest nondairy milk test |5.0910063566116045e+17|http://reut.rs/1rwDBF7
3631|||Mon Sep 08 22:05:27 +0000 2014||Bullying from brothers and sisters may be harmful |5.091002268884869e+17|http://reut.rs/1qylaUg
3632|||Mon Sep 08 21:17:49 +0000 2014||Diabetics pay little attention to salt warnings: study |5.09088238615552e+17|http://reut.rs/1rwqnbp
3633|||Mon Sep 08 21:02:12 +0000 2014||Top U.S. health adviser wants end to partisan fighting over Obamacare |5.090843105282212e+17|http://reut.rs/1rwmjYJ
3634|||Mon Sep 08 20:44:33 +0000 2014||Homeland Security botched pandemic preparedness : U.S. report |5.090798698004767e+17|http://reut.rs/1qy4lJ9
3635|||Mon Sep 08 20:38:13 +0000 2014||Ebola spreads exponentially in Liberia, many more cases soon: WHO |5.0907827497928294e+17|http://reut.rs/1rwg338
3636|||Mon Sep 08 19:50:24 +0000 2014||U.S. Ebola patient at Nebraska hospital eats, listens to music |5.0906624037605786e+17|http://reut.rs/1qxSdIg
3637|||Mon Sep 08 19:38:52 +0000 2014||Could Navy submarine smoking ban lead military to quit? |5.0906333969188045e+17|http://reut.rs/1qxQ6nG
3638|||Mon Sep 08 19:23:15 +0000 2014||Untreated hot flashes may be costly for society : study |5.090594073934602e+17|http://reut.rs/1qxMP7X
3639|||Mon Sep 08 18:50:38 +0000 2014||U.S. military to set up field hospital in Ebola-stricken Liberia |5.090512016864952e+17|http://reut.rs/1qxFB3Y
3640|||Mon Sep 08 17:25:04 +0000 2014||Ebola spread is exponential in Liberia, thousands of cases expected soon: WHO |5.090296681129697e+17|http://reut.rs/1rvo7kC
3641|||Mon Sep 08 16:47:07 +0000 2014||Evotec takes charge for end of diabetes drug development |5.090201182699807e+17|http://reut.rs/1rvdezn
3642|||Mon Sep 08 16:36:34 +0000 2014||U.S. widens program to dispose of prescription drugs |5.0901746061215744e+17|http://reut.rs/1qx9cKH
3643|||Mon Sep 08 15:17:11 +0000 2014||Hundreds of children in U.S. states stricken with respiratory illness |5.089974856294195e+17|http://reut.rs/1ruL3k1
3644|||Mon Sep 08 15:17:11 +0000 2014||Britain to send military, humanitarian experts to fight Ebola |5.089974821775114e+17|http://reut.rs/1qwRZRK
3645|||Mon Sep 08 14:15:04 +0000 2014||Most asthmatic kids lack health management plans at school |5.089818516422697e+17|http://reut.rs/1rus49r
3646|||Mon Sep 08 13:18:27 +0000 2014||Hemispherx to test drugs against Ebola |5.089676022452347e+17|http://reut.rs/1qwsQq5
3647|||Mon Sep 08 13:18:26 +0000 2014||Cost a focus as GSK takes lead in new wave of biotech lung drugs |5.0896759904916685e+17|http://reut.rs/1rua8M9
3648|||Mon Sep 08 13:00:04 +0000 2014||Estonia finds African swine fever in wild boar |5.0896297544137114e+17|http://reut.rs/1qwoX4s
3649|||Mon Sep 08 12:41:08 +0000 2014||Hyperion stops diabetes drug development |5.0895821260365414e+17|http://reut.rs/1qwkQ8D
3650|||Mon Sep 08 12:25:05 +0000 2014||Ebola map shows people in more African regions at risk of animal infection |5.089541736357028e+17|http://reut.rs/1qwi3fI
3651|||Mon Sep 08 11:56:10 +0000 2014||No Saudi ban over Ebola for Nigerians going on haj: Arab News |5.089468966357156e+17|http://reut.rs/1qwcwG1
3652|||Mon Sep 08 11:40:05 +0000 2014||French company Carmat fits second patient with artificial heart |5.089428479621325e+17|http://reut.rs/1rtHZEK
3653|||Mon Sep 08 11:13:06 +0000 2014||Peacekeepers in Somalia use aid to rape women and buy sex for $5: HRW |5.089360569813033e+17|http://reut.rs/1qw4Ymy
3654|||Mon Sep 08 11:13:04 +0000 2014||Sierra Leone lockdown will not help halt Ebola: MSF |5.089360494693171e+17|http://reut.rs/1qw4Y6f
3655|||Mon Sep 08 07:28:04 +0000 2014||AstraZeneca drug misses goal in severe COPD but improves lung function |5.088794267218166e+17|http://reut.rs/1rsEjDc
3656|||Mon Sep 08 06:45:29 +0000 2014||Carmat says fitted a second patient with its artificial heart |5.088687114369352e+17|http://reut.rs/1qvozDy
3657|||Mon Sep 08 05:32:11 +0000 2014||Roche's rheumatoid arthritis drug wins EU approval for extended use |5.088502632227799e+17|http://reut.rs/1rsePGe
3658|||Mon Sep 08 04:20:35 +0000 2014||Harvard receives largest-ever gift, $350 million for public health |5.088322448996557e+17|http://reut.rs/1qv2Bk3
3659|||Sun Sep 07 17:33:33 +0000 2014||Experimental Ebola vaccine protects monkeys for 10 months |5.086694132481024e+17|http://reut.rs/1rpLBHR
3660|||Sun Sep 07 13:20:09 +0000 2014||Obama: U.S. must fight Ebola now or face long-term risk |5.0860564307943424e+17|http://reut.rs/1qsljsq
3661|||Sun Sep 07 11:02:20 +0000 2014||Protalix shares jump on report of possible Ebola drug technology |5.085709599350579e+17|http://reut.rs/1rogr3K
3662|||Sun Sep 07 03:39:34 +0000 2014||U.S. missionary with Ebola showing signs of improvement, wife says |5.084595328847749e+17|http://reut.rs/1qqPZKB
3663|||Sat Sep 06 19:04:45 +0000 2014||Nigerian hospitalized in Israel not sick with Ebola: official |5.08329978379776e+17|http://reut.rs/1qpwhPy
3664|||Sat Sep 06 16:40:42 +0000 2014||Sierra Leone lockdown will not help halt Ebola: MSF |5.0829372433432576e+17|http://reut.rs/1qp6VRL
3665|||Sat Sep 06 09:25:41 +0000 2014||Ebola outbreak stirs anger in fragile Liberia |5.0818424922087424e+17|http://reut.rs/1riJPIF
3666|||Sat Sep 06 02:05:40 +0000 2014||Bristol-Myers sues Merck over U.S. immunotherapy patent |5.080735170283438e+17|http://reut.rs/1rhd6mQ
3667|||Fri Sep 05 23:05:14 +0000 2014||Illinois hospital asks children not to visit due to unknown virus |5.080281103656632e+17|http://reut.rs/1rgz1dZ
3668|||Fri Sep 05 20:26:54 +0000 2014||Depression more common for cancer patients, but rarely treated |5.079882611222241e+17|http://reut.rs/1rfWtrZ
3669|||Fri Sep 05 20:11:17 +0000 2014||Couch-potato kids became couch-potato adults: study |5.079843317514281e+17|http://reut.rs/1qlQQMP
3670|||Fri Sep 05 18:50:43 +0000 2014||WHO urges use of survivors' serum against Ebola, backs vaccine trials |5.079640564020265e+17|http://reut.rs/1qlC2xs
3671|||Fri Sep 05 18:35:13 +0000 2014||Prickless blood sugar test on horizon for diabetics |5.0796015666397184e+17|http://reut.rs/1qlyImf
3672|||Fri Sep 05 17:34:05 +0000 2014||WHO urges drug companies, regulators to speed Ebola work |5.079447714997289e+17|http://reut.rs/1qlmFFs
3673|||Fri Sep 05 16:20:44 +0000 2014||Drug and vaccine makers in race against Ebola |5.07926313655468e+17|http://reut.rs/1reEyBO
3674|||Fri Sep 05 16:20:43 +0000 2014||U.N. to set up Ebola crisis center, aims to stop spread in six-nine months |5.079263103713526e+17|http://reut.rs/1reEx0P
3675|||Fri Sep 05 12:22:09 +0000 2014||U.S. missionary with Ebola arrives in Nebraska for treatment |5.078662731248476e+17|http://reut.rs/1rdnkol
3676|||Fri Sep 05 04:27:15 +0000 2014||Obamacare plan premiums to decline on average in 16 cities: study |5.0774675960745984e+17|http://reut.rs/1qj21pg
3677|||Fri Sep 05 01:58:07 +0000 2014||U.S. missionary with Ebola en route to Nebraska for treatment |5.0770922949155226e+17|http://reut.rs/1raQGDY
3678|||Fri Sep 05 00:09:10 +0000 2014||Kentucky bans tobacco products on most state properties |5.076818104325284e+17|http://reut.rs/1qihEgN
3679|||Thu Sep 04 23:11:44 +0000 2014||WHO report gives misleading view on e-cigarettes, experts argue |5.076673558417244e+17|http://reut.rs/1ra97IQ
3680|||Thu Sep 04 21:58:08 +0000 2014||Weight loss may not improve mood: study |5.0764883426083635e+17|http://reut.rs/1qhTC5B
3681|||Thu Sep 04 21:29:47 +0000 2014||U.S. diet quality improves, but gap widens between rich and poor |5.076416996113244e+17|http://reut.rs/1r9GLyz
3682|||Thu Sep 04 20:58:07 +0000 2014||Plane carrying third U.S. missionary with Ebola leaves Liberia |5.0763373086991974e+17|http://reut.rs/1qhIs0E
3683|||Thu Sep 04 19:24:15 +0000 2014||U.S. FDA approves Merck immune-stimulating drug for melanoma |5.0761010909967155e+17|http://reut.rs/1r96Eyr
3684|||Thu Sep 04 19:08:41 +0000 2014||Breastfeeding may be linked to obese women’s post-pregnancy weight |5.076061925085307e+17|http://reut.rs/1r92IgX
3685|||Thu Sep 04 18:35:17 +0000 2014||Playing it safe and away from lightning |5.075977877356831e+17|http://reut.rs/1r8TK3g
