|author|contents|date|tags|title|tweetid|url
1042|||Fri Jan 30 16:59:45 +0000 2015||Cancer organization partners with NFL on prostate treatment |5.612071496707113e+17|http://reut.rs/1EUa8xr
1043|||Fri Jan 30 16:43:57 +0000 2015||U.S. government releases draft plan for electronic health data |5.612031706057933e+17|http://reut.rs/1A74x7S
1044|||Fri Jan 30 16:07:47 +0000 2015||POM Wonderful ads deceptive and not protected: appeals court |5.6119407167143936e+17|http://reut.rs/1EU2wuO
1045|||Fri Jan 30 15:53:48 +0000 2015||RT @ReutersOpinion: How precision medicine could save your life some day:  http://pbs.twimg.com/media/B8m9gsdIQAAUmc_.jpg|5.611905500960645e+17|http://reut.rs/1EufXEm
1046|||Fri Jan 30 15:24:57 +0000 2015||Liberia delays school reopening by two weeks as Ebola cases fall |5.611832891099095e+17|http://reut.rs/1A6JfYe
1047|||Fri Jan 30 14:28:28 +0000 2015||Ebola likely to persist in 2015 as communities resist aid: Red Cross |5.611690768408494e+17|http://reut.rs/1ETOHfR
1048|||Fri Jan 30 12:15:41 +0000 2015||U.S. proposes effort to analyze DNA from 1 million people |5.61135661231915e+17|http://reut.rs/1A65tcU
1049|||Fri Jan 30 01:36:34 +0000 2015||Suspected Ebola patient admitted to California hospital |5.609748233259909e+17|http://reut.rs/1A4vitV
1050|||Fri Jan 30 00:49:19 +0000 2015||CDC urges measles vaccinations amid Disneyland outbreak |5.609629293284229e+17|http://reut.rs/1A4nLel
1051|||Fri Jan 30 00:33:25 +0000 2015||Study supports Roche's disputed blockbuster flu drug Tamiflu |5.609589303405527e+17|http://reut.rs/1ESC6tA
1052|||Thu Jan 29 22:56:55 +0000 2015||FDA approves Bristol-Myers' HIV drug |5.609346439194911e+17|http://reut.rs/1A44xph
1053|||Thu Jan 29 22:00:22 +0000 2015||Ex-supermodel Waris Dirie says FGM can end in her lifetime |5.609204136442593e+17|http://reut.rs/1ESouyo
1054|||Thu Jan 29 22:00:22 +0000 2015||Poll finds gaping chasm in views between U.S. public, scientists |5.609204118449111e+17|http://reut.rs/1A3SCI7
1055|||Thu Jan 29 21:32:42 +0000 2015||Medical marijuana advocates concerned by Illinois licensing delay |5.609134512967762e+17|http://reut.rs/1ziErMg
1056|||Thu Jan 29 21:32:42 +0000 2015||Withdrawal method linked to condom, pregnancy perceptions |5.609134495435448e+17|http://reut.rs/1A3MyiF
1057|||Thu Jan 29 20:35:11 +0000 2015||Abbott CEO losing no sleep over stronger dollar |5.608989744551977e+17|http://reut.rs/1ESfvx1
1058|||Thu Jan 29 20:35:10 +0000 2015||After heart attacks, most don’t get enough statins |5.608989725467771e+17|http://reut.rs/1A3BmTm
1059|||Thu Jan 29 19:56:50 +0000 2015||Suspected Ebola patient admitted to California hospital |5.6088932550496256e+17|http://reut.rs/1ESbOaT
1060|||Thu Jan 29 19:35:29 +0000 2015|||5.608839511419126e+17|
1061|||Thu Jan 29 19:34:25 +0000 2015||New fund eases expenses for organ donors |5.60883683696341e+17|http://reut.rs/1ES9K2B
1062|||Thu Jan 29 19:34:25 +0000 2015||Should ‘High T’ determine eligibility for women’s sports? |5.6088368195988685e+17|http://reut.rs/1A3oLzs
1063|||Thu Jan 29 19:18:41 +0000 2015||March meeting to plan rebuilding of Ebola-hit states |5.608797240342774e+17|http://reut.rs/1ES8eNJ
1064|||Thu Jan 29 18:33:11 +0000 2015||FDA expands use of Imbruvica to treat rare form of blood cancer |5.6086827294683955e+17|http://reut.rs/1ES3Y0O
1065|||Thu Jan 29 16:56:34 +0000 2015||Young adults say they see e-cigs as safe, fun technology |5.6084395846588416e+17|http://reut.rs/1A2NnZf
1066|||Thu Jan 29 15:01:48 +0000 2015||Medical aid group MSF says pulls out of parts of Sudan |5.608150768534405e+17|http://reut.rs/1A2koF0
1067|||Thu Jan 29 13:42:55 +0000 2015||Exclusive: CDC installing cameras in labs in agency-wide safety push |5.607952272971612e+17|http://reut.rs/1A20tG0
1068|||Thu Jan 29 12:46:35 +0000 2015||UNICEF makes record appeal to help 60 million children in crisis |5.607810504573706e+17|http://reut.rs/1ERoLBH
1069|||Thu Jan 29 11:52:32 +0000 2015||Nigeria H5N1 bird flu spreads to four more states, total 11 |5.607674447098143e+17|http://reut.rs/1ERiyWq
1070|||Thu Jan 29 11:36:56 +0000 2015||Norway finds first case of mad cow disease, says food safe |5.607635200240681e+17|http://reut.rs/1ERh3rd
1071|||Thu Jan 29 09:39:40 +0000 2015||Weekly Ebola cases below 100, WHO says endgame begins |5.6073400968964506e+17|http://reut.rs/1A17iHQ
1072|||Thu Jan 29 07:31:22 +0000 2015||AstraZeneca bets on gene editing for broad range of new drugs |5.607017210608558e+17|http://reut.rs/1A0KJTD
1073|||Thu Jan 29 06:28:16 +0000 2015||As smokers spark up e-cigs to quit, traditional aids suffer |5.6068584367826534e+17|http://reut.rs/1EQQ3Ie
1074|||Wed Jan 28 22:44:40 +0000 2015||U.S. government says Obamacare could affect up to 29 percent of taxpayers |5.605691728755712e+17|http://reut.rs/1EQfmue
1075|||Wed Jan 28 22:37:57 +0000 2015||California's top public health official slams e-cigarettes |5.605674816063406e+17|http://reut.rs/1zZlAcc
1076|||Wed Jan 28 22:37:56 +0000 2015||It does get better for LGBT and questioning youth |5.605674798237737e+17|http://reut.rs/1EQeIwD
1077|||Wed Jan 28 22:37:56 +0000 2015||Salix Pharma to restate past seven quarters' results |5.605674781376635e+17|http://reut.rs/1zZlxNr
1078|||Wed Jan 28 22:37:55 +0000 2015||Some Obamacare insurers discriminate against AIDS patients: study |5.605674762502185e+17|http://reut.rs/1EQeIwF
1079|||Wed Jan 28 22:22:25 +0000 2015||Trial finds GSK Ebola shot is safe and provokes immune response |5.6056357519938765e+17|http://reut.rs/1zZimWb
1080|||Wed Jan 28 22:04:11 +0000 2015||Curcumin may help lower inflammation in metabolic syndrome |5.605589864798208e+17|http://reut.rs/1zZeEeV
1081|||Wed Jan 28 22:04:11 +0000 2015||Tesco recalls squash after complaints of 'foul' smell |5.605589847266017e+17|http://reut.rs/1EQbrxi
1082|||Wed Jan 28 21:41:38 +0000 2015||Statins may benefit women as much as men |5.6055331140194714e+17|http://reut.rs/1EQ8RaE
1083|||Wed Jan 28 21:23:39 +0000 2015||UnitedHealth backs Gilead's Harvoni as preferred hepatitis C treatment |5.6054878627640934e+17|http://reut.rs/1EQ6W61
1084|||Wed Jan 28 21:23:39 +0000 2015||U.S. says 7.3 million choose Obamacare health plans in federal market |5.605487845441536e+17|http://reut.rs/1zZ6pQ6
1085|||Wed Jan 28 21:23:38 +0000 2015||'Expensive' placebo beats 'cheap' one in Parkinson's disease: study |5.605487827615908e+17|http://reut.rs/1EQ6Ye5
1086|||Wed Jan 28 17:43:11 +0000 2015||Medtronic CoreValve safer than surgery in bypass patients: study |5.6049330310454886e+17|http://reut.rs/1EPIIsA
1087|||Wed Jan 28 13:22:04 +0000 2015||Asia needs more cash, campaigns, law changes to end HIV epidemic: U.N. |5.604275891108659e+17|http://reut.rs/1EPbcTi
1088|||Wed Jan 28 06:41:11 +0000 2015||Diagnostics, Tamiflu help Roche full-year sales beat poll |5.603267033783337e+17|http://reut.rs/1zWxpQf
1089|||Wed Jan 28 06:25:23 +0000 2015||Obama's 'precision medicine' plan to boost research, but faces hurdles |5.603227301267661e+17|http://reut.rs/1EOxK6B
1090|||Wed Jan 28 00:36:28 +0000 2015||Abiomed raises revenue outlook, wins U.S. approval for heart pump |5.602349197762519e+17|http://reut.rs/1zVGdWJ
1091|||Wed Jan 28 00:20:47 +0000 2015||University of California on-campus doctors stage rare strike |5.6023097631678464e+17|http://reut.rs/1EOcApi
1092|||Tue Jan 27 23:02:02 +0000 2015||Trouble falling asleep may signal high blood pressure |5.602111552859955e+17|http://reut.rs/1EO8ihr
1093|||Tue Jan 27 23:02:01 +0000 2015||Start worrying about cholesterol in your 30s, study suggests |5.602111533482189e+17|http://reut.rs/1zVq57r
1094|||Tue Jan 27 23:02:01 +0000 2015||School-wide prevention program lowers teen suicide risk |5.6021115133496525e+17|http://reut.rs/1EO8hdD
1095|||Tue Jan 27 22:59:52 +0000 2015||Abiomed raises revenue outlook, wins US approval for heart pump |5.6021061016908186e+17|http://reut.rs/1zVpGSw
1096|||Tue Jan 27 20:49:05 +0000 2015||After Ebola, WHO to set up contingency fund, develop 'surge capacity' |5.601776993781965e+17|http://reut.rs/1zV0ZFV
1097|||Tue Jan 27 20:22:08 +0000 2015||Quest in broad deal with CDC for hepatitis analysis |5.601709155863757e+17|http://reut.rs/1ENUjIt
1098|||Tue Jan 27 20:06:23 +0000 2015||Nursing home patients more likely to be dehydrated |5.601669535419638e+17|http://reut.rs/1zUSwTc
1099|||Tue Jan 27 19:43:51 +0000 2015||U.S. says 9.5 million people enroll for 2015 insurance, beating goal |5.601612828429517e+17|http://reut.rs/1zUO5rq
1100|||Tue Jan 27 19:12:20 +0000 2015||Delinquent kids have earlier sex |5.6015335119599206e+17|http://reut.rs/1zUHhtL
1101|||Tue Jan 27 17:46:51 +0000 2015||Uber says ride services reduce drunk driving |5.6013183943704986e+17|http://reut.rs/1ENG5Y9
1102|||Tue Jan 27 16:59:37 +0000 2015||Indiana agrees to expand Medicaid under Obamacare |5.6011994893336166e+17|http://reut.rs/1ENCHMX
1103|||Tue Jan 27 15:25:10 +0000 2015||Gates, UK take lead in $7.5 billion pledge for children's vaccines |5.6009618263115776e+17|http://reut.rs/1ENwsZG
1104|||Tue Jan 27 14:44:30 +0000 2015||Novartis pharma boss expects pressure on cancer drug prices |5.600859465664676e+17|http://reut.rs/1zTIvpg
1105|||Tue Jan 27 14:44:29 +0000 2015||Workouts get smart, streamlined with tech-personalized routines |5.6008594485517926e+17|http://reut.rs/1ENtILI
1106|||Tue Jan 27 14:01:58 +0000 2015||Plague cases rise in Madagascar, fear of more epidemics: WHO |5.6007524371767706e+17|http://reut.rs/1zTyrMX
1107|||Tue Jan 27 09:11:20 +0000 2015||Scientists ask if Ebola immunizes as well as kills |5.600021047489659e+17|http://reut.rs/1zSzxsr
1108|||Tue Jan 27 09:11:20 +0000 2015||New York clinic that treated comic Joan Rivers sued over her death |5.6000210290765414e+17|http://reut.rs/1ENaBkW
1109|||Tue Jan 27 01:36:38 +0000 2015||Six more measles cases reported in California after Disneyland outbreak |5.598876755333079e+17|http://reut.rs/1DcBcqu
1110|||Tue Jan 27 01:02:48 +0000 2015||E-cigarettes would be banned in public places under California bill |5.598791620399022e+17|http://reut.rs/1zQSr2S
1111|||Tue Jan 27 00:24:35 +0000 2015||Post-Ebola plan needed to avert 'double disaster' in West Africa: Oxfam |5.598695415480443e+17|http://reut.rs/1Dcn9kU
1112|||Mon Jan 26 23:05:48 +0000 2015||New York clinic that treated comic Joan Rivers sued over her death |5.598497151065989e+17|http://reut.rs/1zQqMir
1113|||Mon Jan 26 22:00:37 +0000 2015||U.S. bans deceptive ads by green coffee weight-loss marketer |5.598333107390505e+17|http://reut.rs/1zQa3vK
1114|||Mon Jan 26 21:15:31 +0000 2015||Pfizer cuts vaccine price for poor as GAVI group seeks $7.5 billion |5.598219615140741e+17|http://reut.rs/1DbGVNe
1115|||Mon Jan 26 20:57:26 +0000 2015||FDA names cardiologist to senior leadership position |5.598174106526761e+17|http://reut.rs/1DbCwtI
1116|||Mon Jan 26 20:46:09 +0000 2015||Institutional neglect changes kids’ brain structure |5.5981457287468646e+17|http://reut.rs/1zPQO5l
1117|||Mon Jan 26 19:49:58 +0000 2015||PBM EnvisionRx chooses Gilead hepatitis C drugs for its formulary |5.598004350544937e+17|http://reut.rs/1zPCqKm
1118|||Mon Jan 26 19:49:58 +0000 2015||Canada resident tests positive for H7N9 avian flu virus |5.598004331712512e+17|http://reut.rs/1DblD2d
1119|||Mon Jan 26 19:49:58 +0000 2015||FDA approves Teva's generic version of AstraZeneca's Nexium |5.5980043144321434e+17|http://reut.rs/1zPCsBY
1120|||Mon Jan 26 18:49:15 +0000 2015||Single new case can reignite Ebola outbreak if vigilance lost, says MSF |5.597851552176169e+17|http://reut.rs/1zPnUlQ
1121|||Mon Jan 26 18:35:33 +0000 2015||Ohio sues over Obamacare taxes on state, local governments |5.5978170742841754e+17|http://reut.rs/1Db50E5
1122|||Mon Jan 26 17:46:06 +0000 2015||U.S. government unveils goal to move Medicare away from fee-for-service |5.5976925957718426e+17|http://reut.rs/1zP71Yt
1123|||Mon Jan 26 17:01:04 +0000 2015||California turkey farm quarantined after bird flu detected |5.5975792857686835e+17|http://reut.rs/1zOVFDO
1124|||Mon Jan 26 17:01:04 +0000 2015||'Autisms' a more appropriate term than 'autism,' geneticists say |5.597579267103785e+17|http://reut.rs/1DaDxCn
1125|||Mon Jan 26 15:06:09 +0000 2015||Supreme Court sends patent cases back to appeals court |5.5972900653132595e+17|http://reut.rs/1zOtdCc
1126|||Mon Jan 26 14:07:37 +0000 2015||Senegal reopens land border with Ebola-hit Guinea |5.597142776582144e+17|http://reut.rs/1D9QUCX
1127|||Mon Jan 26 13:47:21 +0000 2015||FDA approves Rockwell Medical's iron replacement drug |5.5970917879801446e+17|http://reut.rs/1zO3Q3q
1128|||Mon Jan 26 11:23:23 +0000 2015||Deadly Japanese encephalitis surges in northeast India |5.596729471627592e+17|http://reut.rs/1zNw0eE
1129|||Mon Jan 26 06:37:25 +0000 2015||Regeneron/Sanofi cholesterol drug gets FDA priority review |5.5960098033842176e+17|http://reut.rs/1D8qQIl
1130|||Mon Jan 26 06:21:40 +0000 2015||Safety concerns cloud early promise of powerful new cancer drugs |5.5959701850373734e+17|http://reut.rs/1D8ocCb
1131|||Mon Jan 26 05:54:41 +0000 2015||U.S. pediatricians reaffirm opposition to legalized pot |5.595902277284004e+17|http://reut.rs/1D8kbxO
1132|||Mon Jan 26 05:54:41 +0000 2015||Preemies less lucky in love as young adults, study suggests |5.5959022597521e+17|http://reut.rs/1zMms3E
1133|||Mon Jan 26 05:54:40 +0000 2015||Breast cancer patients lack knowledge of their tumors |5.595902240038666e+17|http://reut.rs/1D8k9WB
1134|||Sun Jan 25 13:44:31 +0000 2015||Ebola waning, but WHO must respond better next time, Chan says |5.593460747801846e+17|http://reut.rs/1D63mn8
1135|||Sat Jan 24 19:21:34 +0000 2015||British nurse makes full recovery from Ebola |5.590685108409631e+17|http://reut.rs/1D3sfzU
1136|||Sat Jan 24 15:47:47 +0000 2015||Liberia Ebola vaccine trial 'challenging' as cases tumble |5.590147103483781e+17|http://reut.rs/1D2Nce7
1137|||Sat Jan 24 11:58:21 +0000 2015||Gates sees 'miracle' tools for AIDS by 2030 in vaccine and drugs |5.5895696927361434e+17|http://reut.rs/1D2d1uZ
1138|||Sat Jan 24 00:33:35 +0000 2015||Pediatrician group urges measles vaccinations amid Disneyland outbreak |5.5878464556813926e+17|http://reut.rs/1zEGu04
1139|||Sat Jan 24 00:17:52 +0000 2015||FDA approves NPS drug, in move validating Shire takeover deal |5.587806871769784e+17|http://reut.rs/1zEE2Xf
1140|||Fri Jan 23 23:41:45 +0000 2015||Fewer celiac diagnoses among poor UK children |5.5877159898383155e+17|http://reut.rs/1D0FQrt
1141|||Fri Jan 23 21:19:57 +0000 2015||Ebola experts say 16 other bat viruses could infect man |5.587359161778422e+17|http://reut.rs/1D0hfmJ
1142|||Fri Jan 23 18:31:10 +0000 2015||Just five Ebola cases left in Liberia, government says |5.5869344002922906e+17|http://reut.rs/1CZJylc
1143|||Fri Jan 23 17:57:25 +0000 2015||School-wide prevention program lowers teen suicide risk |5.586849449488097e+17|http://reut.rs/1CZBQYj
1144|||Fri Jan 23 17:57:25 +0000 2015||Could flu vaccination protect your sense of smell? |5.5868494329624576e+17|http://reut.rs/1CZBTDt
1145|||Fri Jan 23 16:54:34 +0000 2015||Pediatrician group urges measles vaccinations amid Disneyland outbreak |5.586691305269125e+17|http://reut.rs/1CZn0kD
1146|||Fri Jan 23 16:54:34 +0000 2015||Anger, mistrust in Guinea villages hinders battle to beat Ebola |5.586691288072274e+17|http://reut.rs/1zDo93e
1147|||Fri Jan 23 16:54:34 +0000 2015||Portable X-ray services becoming more common |5.5866912667233485e+17|http://reut.rs/1CZn0kI
1148|||Fri Jan 23 16:54:33 +0000 2015||Plaintiffs’ lawyers reject J&amp;J claims of fraud in mesh lawsuits |5.58669124713599e+17|http://reut.rs/1zDo7Zj
1149|||Fri Jan 23 16:38:41 +0000 2015||Dire needs of southern African flood survivors unmet two weeks on |5.586651333048648e+17|http://reut.rs/1CZjc2Q
1150|||Fri Jan 23 14:48:19 +0000 2015||WHO runs low on cash for Ebola but progress key before rainy season |5.586373581540065e+17|http://reut.rs/1CYRbsh
1151|||Fri Jan 23 13:22:54 +0000 2015||Europe recommends seven new medicines for approval |5.5861586216985395e+17|http://reut.rs/1zCLmmc
1152|||Fri Jan 23 13:04:51 +0000 2015||After Ebola, flu and drug resistance top pandemic threats |5.586113167644549e+17|http://reut.rs/1zCHjq1
1153|||Fri Jan 23 13:04:50 +0000 2015||Novartis' Jakavi drug wins EU green light for wider use |5.5861131491518054e+17|http://reut.rs/1CYsP1Q
1154|||Fri Jan 23 13:04:49 +0000 2015||EU regulator recommends suspension of drugs over Indian data |5.58611308397228e+17|http://reut.rs/1zCHl1e
1155|||Fri Jan 23 06:28:22 +0000 2015||First GSK Ebola vaccine shipment due to arrive in Liberia |5.5851154101295514e+17|http://reut.rs/1CXfeHZ
1156|||Fri Jan 23 02:25:22 +0000 2015||Disneyland seeks to reassure public amid measles outbreak |5.584503887358853e+17|http://reut.rs/1CWB0vB
1157|||Fri Jan 23 00:59:41 +0000 2015||Superbug spread through contaminated scopes sickened dozens in Seattle |5.5842882261878784e+17|http://reut.rs/1CWjGqi
1158|||Thu Jan 22 23:02:33 +0000 2015||Sierra Leone lifts Ebola quarantine measures amid progress |5.583993476213842e+17|http://reut.rs/1CVW19x
1159|||Thu Jan 22 22:37:51 +0000 2015||Superbug spread through contaminated scopes sickened dozens in Seattle |5.583931299557581e+17|http://reut.rs/1zAwPrc
1160|||Thu Jan 22 21:57:32 +0000 2015||Mobile game may have lasting benefit for 'lazy' eye |5.583829832591237e+17|http://reut.rs/1CVGqH2
1161|||Thu Jan 22 20:51:59 +0000 2015||FDA panel backs Astellas drug for invasive fungal infections |5.583664869020959e+17|http://reut.rs/1CVqEMc
1162|||Thu Jan 22 20:15:59 +0000 2015||Disneyland seeks to reassure public amid measles outbreak |5.5835742814078566e+17|http://reut.rs/1zA71eX
1163|||Thu Jan 22 20:00:30 +0000 2015||Wide use of prescription painkillers found in U.S. women of childbearing age: CDC |5.58353533050028e+17|http://reut.rs/1CVdUFs
1164|||Thu Jan 22 19:35:44 +0000 2015||U.S. health officials say Ebola treatment trial to start soon in Liberia |5.583472986281779e+17|http://reut.rs/1zzZH31
1165|||Thu Jan 22 18:53:55 +0000 2015||Sierra Leone emergency anti-malaria drive reaches 2.5 million people |5.5833677623095296e+17|http://reut.rs/1zzQPKD
1166|||Thu Jan 22 18:53:55 +0000 2015||Vaccines group seeks $7.5 billion as disease fight reaches peak |5.583367745993482e+17|http://reut.rs/1CUWU21
1167|||Thu Jan 22 18:53:54 +0000 2015||Laws deny leprosy sufferers right to work, travel, marry: study |5.583367724476662e+17|http://reut.rs/1zzQPKG
1168|||Thu Jan 22 18:53:54 +0000 2015||Express Scripts' Miller says hepatitis C price war to save billions |5.58336770849665e+17|http://reut.rs/1CUWU25
1169|||Thu Jan 22 18:53:53 +0000 2015||Nebraska hospital releases patient found not to have Ebola |5.5833676909644595e+17|http://reut.rs/1zzQQ0Y
1170|||Thu Jan 22 18:53:53 +0000 2015||Costly, complex headache treatment on the rise |5.583367673222472e+17|http://reut.rs/1CUWRn4
1171|||Thu Jan 22 16:28:48 +0000 2015||Heavy soccer playing before age 12 tied to later hip deformities |5.583002553061499e+17|http://reut.rs/1y35qHI
1172|||Thu Jan 22 11:33:42 +0000 2015||Nigeria H5N1 bird flu now in 7 states, suspected in 140,000 birds: minister |5.582259926665953e+17|http://reut.rs/1y1PrJU
1173|||Thu Jan 22 11:33:42 +0000 2015||The smoke around e-cig science |5.582259910685737e+17|http://reut.rs/1uxn5N4
1174|||Thu Jan 22 11:06:43 +0000 2015||Ebola ebbing in West Africa but vigilance needed: WHO |5.582191997731717e+17|http://reut.rs/1y1IPLO
1175|||Thu Jan 22 08:53:58 +0000 2015||UK aims to pass law to ban branding on cigarette packs before May |5.581857934462198e+17|http://reut.rs/1y1eigZ
1176|||Thu Jan 22 03:27:20 +0000 2015||Washington state attorney general seeks to raise smoking age to 21 |5.581035926878986e+17|http://reut.rs/1uvRPya
1177|||Thu Jan 22 01:28:01 +0000 2015||Five Disneyland employees infected with measles in California |5.580735657494692e+17|http://reut.rs/1uvpW9s
1178|||Thu Jan 22 00:27:34 +0000 2015||Video-based therapy may help babies at risk of autism: study |5.5805835561772646e+17|http://reut.rs/1xZwrfg
1179|||Wed Jan 21 23:56:01 +0000 2015||Counterfeit Cialis found entering U.S. by mail: FDA |5.5805041619451904e+17|http://reut.rs/1uv4bq7
1180|||Wed Jan 21 22:26:05 +0000 2015||Alcohol ads on TV tied to youth drinking risk |5.580277798000394e+17|http://reut.rs/1xZ3Gza
1181|||Wed Jan 21 22:26:04 +0000 2015||Five Disneyland employees infected with measles in California |5.580277779839099e+17|http://reut.rs/1xZ3Dnb
1182|||Wed Jan 21 22:26:04 +0000 2015||Ramping up e-cigarette voltage produces more formaldehyde: study |5.5802777618036326e+17|http://reut.rs/1uuITJd
1183|||Wed Jan 21 22:26:03 +0000 2015||Idaho confirms avian flu cases as Washington imposes new quarantine |5.5802777291720704e+17|http://reut.rs/1xZ3DDt
1184|||Wed Jan 21 21:54:28 +0000 2015||More older adults are reporting falls |5.580198234779894e+17|http://reut.rs/1uuzVfg
1185|||Wed Jan 21 21:54:27 +0000 2015||Sierra Leone to reopen schools in March as Ebola infections slow |5.5801982156538675e+17|http://reut.rs/1xYW2op
1186|||Wed Jan 21 21:15:54 +0000 2015||LGBT health concerns need special attention: experts |5.58010119158784e+17|http://reut.rs/1xYL1n3
1187|||Wed Jan 21 20:17:18 +0000 2015||Youth cholesterol drops, blood pressure holds steady |5.5799537068149965e+17|http://reut.rs/1uu7n5n
1188|||Wed Jan 21 19:43:37 +0000 2015||Obamacare enrollment hits 7.1 million so far for 2015 coverage |5.5798689652227686e+17|http://reut.rs/1xYk6Ia
1189|||Wed Jan 21 19:18:49 +0000 2015||Washington state attorney general seeks to raise smoking age to 21 |5.579806566813532e+17|http://reut.rs/1utPZ0A
1190|||Wed Jan 21 19:03:20 +0000 2015||Years of night-shifts linked to women’s risk of heart disease, cancer |5.579767561967575e+17|http://reut.rs/1utL9R3
1191|||Wed Jan 21 18:04:41 +0000 2015||FDA approves Novartis's psoriasis drug |5.579619985549025e+17|http://reut.rs/1xXSz9S
1192|||Wed Jan 21 16:39:19 +0000 2015||MSF resumes work in Myanmar state after government ban |5.579405160008909e+17|http://reut.rs/1xXuwrq
1193|||Wed Jan 21 16:32:18 +0000 2015||U.S. insurance study charts huge price gaps for hip, knee surgery |5.5793875135655936e+17|http://reut.rs/1ut2Yja
1194|||Wed Jan 21 15:33:35 +0000 2015||U.N. Ebola chief calls for final $1 billion to fight virus |5.579239747312722e+17|http://reut.rs/1xXc16u
1195|||Wed Jan 21 15:33:35 +0000 2015||On Ebola front line, first glimpse of end to epidemic |5.5792397312066765e+17|http://reut.rs/1usMYOd
1196|||Wed Jan 21 13:43:23 +0000 2015||BPA plastics chemical poses no health risk, says European watchdog |5.578962415612109e+17|http://reut.rs/1usk4h9
1197|||Wed Jan 21 02:28:03 +0000 2015||Brain-training game maker settles with U.S. FTC over unsupported claims |5.577262871132447e+17|http://reut.rs/1uq0q5t
1198|||Tue Jan 20 22:27:12 +0000 2015||Older minds need physical and mental activity |5.57665675372929e+17|http://reut.rs/1updEPH
1199|||Tue Jan 20 22:11:32 +0000 2015||Fitness apps lack evidence-based tools |5.5766173337309594e+17|http://reut.rs/1up9Az3
1200|||Tue Jan 20 21:35:16 +0000 2015||New outbreak of avian flu found in Washington state |5.5765260576230195e+17|http://reut.rs/1xSW2q6
1201|||Tue Jan 20 21:35:16 +0000 2015||AAA invests $12 million in study of older drivers’ needs |5.57652604101333e+17|http://reut.rs/1up1qXp
1202|||Tue Jan 20 21:35:15 +0000 2015||Calorie counts on menus used by women, wealthier diners in Seattle area |5.576526017651016e+17|http://reut.rs/1xSW1T3
1203|||Tue Jan 20 19:47:24 +0000 2015||Disneyland measles outbreak prompts warning at high school |5.576254604654756e+17|http://reut.rs/1xSpsVe
1204|||Tue Jan 20 18:06:01 +0000 2015||Gym time won’t cancel out too much sitting |5.575999475716178e+17|http://reut.rs/1uocQuv
1205|||Tue Jan 20 18:06:01 +0000 2015||Pizza days boost kids' calorie and fat intake |5.575999458729206e+17|http://reut.rs/1xRVbGf
1206|||Tue Jan 20 17:50:13 +0000 2015||It takes two: Getting healthy may be easier with a partner |5.575959699453624e+17|http://reut.rs/1uo8B29
1207|||Tue Jan 20 17:21:06 +0000 2015||Kindergarten skills vary by kids’ social, economic status |5.575886420558766e+17|http://reut.rs/1xRHxD2
1208|||Tue Jan 20 15:44:20 +0000 2015||Supreme Court rules for Teva in over multiple sclerosis drug patent |5.5756428975067136e+17|http://reut.rs/1unD8Ns
1209|||Tue Jan 20 14:05:11 +0000 2015||Economic impact of Ebola less severe than first thought: World Bank |5.5753933700990566e+17|http://reut.rs/1xQK1RV
1210|||Tue Jan 20 12:26:07 +0000 2015||Big city life may not be a key asthma risk: U.S. study |5.575144089400115e+17|http://reut.rs/1umRZIb
1211|||Tue Jan 20 07:58:22 +0000 2015||Richter and Actavis say Cariprazine effective on schizophrenia relapse |5.5744702727847936e+17|http://reut.rs/1ulYY3Q
1212|||Tue Jan 20 05:16:09 +0000 2015||MSF slams expensive vaccines, urges GSK and Pfizer to cut prices |5.574062044741632e+17|http://reut.rs/1ulHB3k
1213|||Mon Jan 19 15:07:46 +0000 2015||Israel reports bird flu outbreak at turkey farm: OIE |5.571926999218299e+17|http://reut.rs/1xLDxny
1214|||Mon Jan 19 15:07:45 +0000 2015||Underimmunized, unvaccinated families cluster together |5.571926976401408e+17|http://reut.rs/1uj3IYe
1215|||Mon Jan 19 14:47:57 +0000 2015||Baby's age at gluten exposure not tied to celiac disease |5.571877146224476e+17|http://reut.rs/1uiZPCu
1216|||Mon Jan 19 13:19:36 +0000 2015||Tethered to treadmills? Try the cardio machines in the corner |5.571654773286052e+17|http://reut.rs/1uiGK3c
1217|||Mon Jan 19 13:19:35 +0000 2015||Exclusive: Merck funds tests of lower Zilmax doses as seen seeking way to resume sales |5.571654755795927e+17|http://reut.rs/1xLawbz
1218|||Mon Jan 19 11:47:14 +0000 2015||Woman dies of H5N1 bird flu in Egypt, fourth death this year |5.5714223393867366e+17|http://reut.rs/1uinnY7
1219|||Mon Jan 19 11:31:25 +0000 2015||WHO says chronic diseases kill 3 million annually in China |5.571382547395502e+17|http://reut.rs/1uikjeF
