|author|contents|date|tags|title|tweetid|url
0||LOS ANGELES (Reuters) - Authorities in Los Angeles have shuttered 500 medical marijuana dispensaries since residents voted two years ago to cap the number of pot shops in the city at about 130, officials said on Thursday. , City Attorney Mike Feuer told reporters hundreds of the illegal businesses still operate, highlighting the challenges of reining in the dispensaries in Los Angeles, which is widely believed to have more pot shops than any U.S. metropolis. , To achieve the closures, Los Angeles officials have filed criminal and civil cases against some dispensary owners, and have sent letters threatening legal action against landlords who lease space to dispensaries, officials said. , The medical cannabis shops opened in the years after a vote by California residents in 1996 to permit medicinal use of the drug, which remains banned under federal law.  , Twenty-three U.S. states allow medical pot, while four states and the District of Columbia have approved recreational marijuana use by adults. , Efforts to control the number of dispensaries in Los Angeles, the nation’s second-largest city, have at times been compared with a game of whack-a-mole, as the owners of some shops move their businesses to escape enforcement. , The dispensaries, which are usually identified by a green medical cross posted on a storefront, have long drawn complaints from neighbors upset about the pungent smell and the risk of minors getting marijuana from dispensary customers.   , But Feuer said the number of complaints has fallen over the last two years, in what he said was a sign the crackdown by his office is working. He declined to give an exact estimate of how many dispensaries still exist.     , “While we have succeeded in a remarkable way up to this point, we are far from through,” Feuer told a news conference. , Los Angeles residents voted in 2013 to cap the number of dispensaries at about 130, or roughly as many as registered with the city in 2007 when city leaders first tried to limit their numbers. , Under California’s rules, the dispensaries cannot be located near schools, and must follow other regulations such as not having illuminated signs visible at night.   , Estimates for the number of dispensaries currently operating in the city have varied widely. , A survey last September by the University of California, Los Angeles, found at least 410 in operation, said Bridget Freisthler, a professor of social welfare at the school. |Thu Apr 09 21:40:16 +0000 2015||Los Angeles closes 500 medical marijuana shops, but hundreds remain |5.862825039813755e+17|http://reut.rs/1CvkXmm
1|||Thu Apr 09 21:24:27 +0000 2015||U.S. cuts poultry export forecast as deadly bird flu spreads |5.862785247487508e+17|http://reut.rs/1abCAQY
2|||Thu Apr 09 21:04:15 +0000 2015||Fears over Roundup herbicide residues prompt private testing |5.862734418016993e+17|http://reut.rs/1DpfmCU
3|||Thu Apr 09 19:49:50 +0000 2015||Liberia watchdog says some Ebola funds unaccounted for |5.86254712523096e+17|http://reut.rs/1Dp1vfF
4|||Thu Apr 09 19:07:10 +0000 2015||Diabetes devices may interfere with avalanche beacon signals |5.862439763337871e+17|http://reut.rs/1DoTDLl
5|||Thu Apr 09 18:58:12 +0000 2015||Three in Texas infected with Listeria from tainted ice cream: CDC |5.862417204902748e+17|http://reut.rs/1DoRX4s
6|||Thu Apr 09 18:01:58 +0000 2015||Mediterranean rescuers in quest for seaborne migrants' chef |5.862275685269176e+17|http://reut.rs/1CuvM85
7|||Thu Apr 09 17:00:56 +0000 2015||Fidelity CEO taps personal fortune for bets on cancer-related IPOs |5.862122067291341e+17|http://reut.rs/1CufHPU
8|||Thu Apr 09 16:27:23 +0000 2015||Mexico reports bird flu outbreaks in Puebla and Oaxaca states |5.862037667744645e+17|http://reut.rs/1Cu6UgG
9|||Thu Apr 09 16:09:08 +0000 2015||Can special flooring reduce fall injuries for elderly? |5.861991734998508e+17|http://reut.rs/1DolhYO
10|||Thu Apr 09 16:09:08 +0000 2015||When surgeons say ‘we can fix it,’ patients may misunderstand risks |5.861991715873055e+17|http://reut.rs/1Cu2dU6
11|||Thu Apr 09 12:51:04 +0000 2015||Detecting diabetes in children before symptoms appear |5.861493262058824e+17|http://reut.rs/1CtdtAf
12|||Thu Apr 09 12:26:17 +0000 2015||Niger isolates suspected bird flu farm as region takes precautions |5.861430918931087e+17|http://reut.rs/1Ct7r2B
13|||Thu Apr 09 06:03:35 +0000 2015||Sabra Dipping Co recalls 30,000 cases of hummus over Listeria fears |5.860467810557051e+17|http://reut.rs/1CrMAwn
14|||Thu Apr 09 05:16:24 +0000 2015||California bill banning child vaccine exemptions moves ahead |5.860349062764339e+17|http://reut.rs/1CrDIH4
15|||Thu Apr 09 00:01:17 +0000 2015||U.S. bird flu outbreak accelerates as wild ducks migrate north |5.859556071251067e+17|http://reut.rs/1CqEV1z
16|||Thu Apr 09 00:01:17 +0000 2015||U.S. appeals court deals setback to Florida tobacco plaintiffs |5.859556050111775e+17|http://reut.rs/1DlT2K8
17|||Wed Apr 08 23:29:40 +0000 2015||Oklahoma set to join Kansas in banning flashpoint abortion procedure |5.859476507442668e+17|http://reut.rs/1CqyhIC
18|||Wed Apr 08 22:22:13 +0000 2015||Memory may suffer in mothers caring for disabled children |5.859306743408108e+17|http://reut.rs/1DlA8Dq
19|||Wed Apr 08 21:01:12 +0000 2015||Celladon to report results of its gene therapy for heart failure: CEO |5.859102839541719e+17|http://reut.rs/1CpZ6g0
20|||Wed Apr 08 20:45:22 +0000 2015||Midlife arts, crafts and socializing tied to better late-life cognition |5.859063019616666e+17|http://reut.rs/1DlfOCa
21|||Wed Apr 08 20:45:22 +0000 2015||Canada bird flu virus in Ontario highly pathogenic strain |5.859062998729236e+17|http://reut.rs/1CpVnPu
22|||Wed Apr 08 20:05:10 +0000 2015||Common painkiller may not ease lower back pain or osteoarthritis |5.858961840211804e+17|http://reut.rs/1CpKux1
23|||Wed Apr 08 20:05:09 +0000 2015||30 new Ebola cases, lowest weekly figure in nearly a year: WHO |5.85896182100136e+17|http://reut.rs/1Dl7UZo
24|||Wed Apr 08 19:01:53 +0000 2015||Fatal crashes involving teen drivers decline sharply in U.S |5.858802581230592e+17|http://reut.rs/1DkWkxs
25|||Wed Apr 08 18:46:07 +0000 2015||Injury prevention programs unpopular with high school coaches |5.858762919766221e+17|http://reut.rs/1CpqB9m
26|||Wed Apr 08 14:31:44 +0000 2015||UK biotech Silence Therapeutics raises $58 million for its RNA drive |5.858122726620652e+17|http://reut.rs/1Co8ror
27|||Wed Apr 08 10:33:03 +0000 2015||Chinese citizens sue government over transparency on Monsanto herbicide |5.857522072634e+17|http://reut.rs/1Cn9e9f
28|||Wed Apr 08 00:00:39 +0000 2015||Kansas becomes first state to ban a second trimester abortion procedure |5.855930600856699e+17|http://reut.rs/1Cl0YGG
29|||Tue Apr 07 22:57:24 +0000 2015||Kids may be more likely to use customized playgrounds |5.855771422867333e+17|http://reut.rs/1CkO1g2
30|||Tue Apr 07 22:12:22 +0000 2015||Minnesota bird flu cases rise as U.S. investigators arrive |5.855658059595899e+17|http://reut.rs/1CkEiXh
31|||Tue Apr 07 21:36:34 +0000 2015||Higher purpose in life tied to better brain health |5.85556798217855e+17|http://reut.rs/1Dh1oTj
32|||Tue Apr 07 21:04:53 +0000 2015||Taiwan, Japan ban Ontario poultry over Canada bird flu |5.85548824128684e+17|http://reut.rs/1DgTTMg
33|||Tue Apr 07 20:31:14 +0000 2015||FDA accepts Novo Nordisk's resubmitted application for insulin drug |5.855403582280704e+17|http://reut.rs/1CkhlDC
34|||Tue Apr 07 20:22:00 +0000 2015||With diabetes, fewer meals may mean less hunger, depression |5.855380342061261e+17|http://reut.rs/1DgKYuc
35|||Tue Apr 07 18:29:37 +0000 2015||Erectile dysfunction drugs vary in effectiveness, side effects |5.855097511083049e+17|http://reut.rs/1CjK0Zs
36|||Tue Apr 07 17:28:36 +0000 2015||Sierra Leone says Kailahun Ebola case report was mistaken |5.85494395148968e+17|http://reut.rs/1CjpTKK
37|||Tue Apr 07 16:09:54 +0000 2015||Unrelated 'next of kin' may lead to legal confusion |5.854745894483476e+17|http://reut.rs/1DfWwhh
38|||Tue Apr 07 15:38:24 +0000 2015||Hospira gets FDA warning letter for Italian facility |5.854666633294684e+17|http://reut.rs/1DfQYDH
39|||Tue Apr 07 14:42:15 +0000 2015||U.S. FDA staff: Swedish Match snus proposal raises questions |5.854525334616883e+17|http://reut.rs/1CiqkVF
40|||Tue Apr 07 14:42:15 +0000 2015||U.S. Ebola patient's condition improves to good: NIH |5.85452531553325e+17|http://reut.rs/1DfIImZ
41|||Tue Apr 07 13:29:50 +0000 2015||Acacia rigidula supplements still containing stimulant found on market |5.854343090724127e+17|http://reut.rs/1Dfs4UJ
42|||Tue Apr 07 12:11:02 +0000 2015||Robotic glove could help stroke survivors |5.854144782353121e+17|http://reut.rs/1DfgxET
43|||Tue Apr 07 00:37:32 +0000 2015||Sterilization threat darkens Europe's transgender quest for identity |5.852399517862461e+17|http://reut.rs/1DdX1IP
44|||Tue Apr 07 00:37:31 +0000 2015||Bird flu confirmed on turkey farm in Woodstock, Ontario |5.852399499072594e+17|http://reut.rs/1CexFFQ
45|||Mon Apr 06 22:35:56 +0000 2015||For some elderly, unclogging leg arteries doesn't improve mobility |5.852093501107323e+17|http://reut.rs/1DdyXpo
46|||Mon Apr 06 21:30:41 +0000 2015||Jenny Craig, Weight Watchers better commercial diet choices |5.851929300774748e+17|http://reut.rs/1CdM3OF
47|||Mon Apr 06 21:30:41 +0000 2015||Physical therapy may be as good as surgery for common back problem |5.851929278838784e+17|http://reut.rs/1DdlUo0
48|||Mon Apr 06 21:14:56 +0000 2015||U.S. regulator says 2016 payments for Medicare Advantage to rise |5.851889670012887e+17|http://reut.rs/1CdHFz0
49|||Mon Apr 06 19:02:00 +0000 2015||States ask U.S. Congress to launch inquiry of herbal supplements |5.851555122426798e+17|http://reut.rs/1DcLZnf
50|||Mon Apr 06 17:38:40 +0000 2015||Breast milk sold online may contain cow's milk |5.851345402361815e+17|http://reut.rs/1CczqDj
51|||Mon Apr 06 17:13:56 +0000 2015||Remove financial barriers to organ donation, experts say |5.851283165265347e+17|http://reut.rs/1Dcknyw
52|||Mon Apr 06 16:58:05 +0000 2015||Minnesota finds two more turkey flocks infected with lethal bird flu |5.851243283809894e+17|http://reut.rs/1CcnGAJ
53|||Mon Apr 06 16:01:59 +0000 2015||Less than recommended physical activity may still lengthen life |5.851102118175785e+17|http://reut.rs/1Cc6VWm
54|||Mon Apr 06 13:53:54 +0000 2015||Bristol-Myers buys into Dutch gene therapy company uniQure |5.850779775217418e+17|http://reut.rs/1CbuMpj
55|||Mon Apr 06 10:17:27 +0000 2015||Two Syrians die from H1N1 swine flu |5.850235061921464e+17|http://reut.rs/1Cav6Vd
56|||Mon Apr 06 10:01:42 +0000 2015||DreaMed Diabetes technology to be used in Medtronic insulin pump |5.850195413040087e+17|http://reut.rs/1Car0wg
57|||Sun Apr 05 10:57:22 +0000 2015||Second Carmat artificial heart patient 'never felt so good': newspaper |5.846711627577098e+17|http://reut.rs/1C4YYlZ
58|||Sun Apr 05 03:11:00 +0000 2015||Listeria fear spreads as Blue Bell closes Oklahoma ice cream plant |5.845537985988116e+17|http://reut.rs/1D5MBLg
59|||Sun Apr 05 00:22:17 +0000 2015||Morphosys CEO says MOR202 drug candidate still promising: newspaper |5.845113404018483e+17|http://reut.rs/1D5mRie
60|||Sat Apr 04 22:38:35 +0000 2015||Eastern Sierra Leone records first Ebola case in months |5.844852410305987e+17|http://reut.rs/1C2ibVm
61|||Sat Apr 04 12:15:08 +0000 2015||France bans super-skinny models in anorexia clampdown |5.84328343933313e+17|http://reut.rs/1C01OIR
62|||Fri Apr 03 20:09:29 +0000 2015||Is fish oil safe during chemotherapy? |5.840853304977981e+17|http://reut.rs/1D1o0Ho
63|||Fri Apr 03 17:23:09 +0000 2015||Obese people may be more sensitive to food smells |5.840434739359498e+17|http://reut.rs/1BWGZxR
64|||Fri Apr 03 17:23:09 +0000 2015||‘Grandparenting’ in moderation might help keep the mind sharp |5.840434718723277e+17|http://reut.rs/1D0SRnm
65|||Fri Apr 03 17:05:10 +0000 2015||Childhood ADHD linked to secondhand smoking |5.840389483112735e+17|http://reut.rs/1BWCXpq
66|||Fri Apr 03 09:43:42 +0000 2015||France bans skinny models in anorexia clamp-down |5.8392784901231e+17|http://reut.rs/1BUWma9
67|||Thu Apr 02 21:38:33 +0000 2015||Asthma very common among Olympic-level swimmers |5.837453595932221e+17|http://reut.rs/1BSMUUS
68|||Thu Apr 02 20:53:31 +0000 2015||Deadly snakes 'milked' to create potent new anti-venom |5.837340252081316e+17|http://reut.rs/1BSFbWH
69|||Thu Apr 02 20:37:45 +0000 2015||Walking may help overweight people curb sugar cravings |5.837300566247465e+17|http://reut.rs/1BSCt3t
70|||Thu Apr 02 20:37:44 +0000 2015||States ask U.S. Congress to launch inquiry of herbal supplements |5.837300547163382e+17|http://reut.rs/1y4g9sP
71|||Thu Apr 02 17:46:39 +0000 2015||Swedish Match gears up for closely watched FDA panel meeting |5.836869985793597e+17|http://reut.rs/1y3Etei
72|||Thu Apr 02 16:43:30 +0000 2015||Minimally invasive surgery safe for rectal cancer |5.83671106311213e+17|http://reut.rs/1y3qfdj
73|||Thu Apr 02 16:12:03 +0000 2015||Patients may prefer getting biopsy results by phone |5.83663190686466e+17|http://reut.rs/1BRIZY9
74|||Thu Apr 02 15:58:32 +0000 2015||Top U.S. turkey producer Minnesota finds 4th bird flu case: USDA |5.836597917147546e+17|http://reut.rs/1BRF9yl
75|||Thu Apr 02 15:22:37 +0000 2015||Study suggests surgeons do get better with experience |5.83650750154281e+17|http://reut.rs/1BRvF6a
76|||Thu Apr 02 14:35:15 +0000 2015||Patient tests negative for Ebola in Colorado: state health officials |5.836388299213906e+17|http://reut.rs/1BRiK48
77|||Thu Apr 02 12:56:14 +0000 2015||Greece scraps hospital visit fee, to hire health workers |5.836139133019095e+17|http://reut.rs/1CB8PTL
78|||Thu Apr 02 10:47:49 +0000 2015||India to add more AIDS, TB drugs to essential medicines list: sources |5.835815939163505e+17|http://reut.rs/1CAGb5p
79|||Thu Apr 02 09:33:35 +0000 2015||Patient evaluated for Ebola at Colorado hospital after seeing symptoms |5.835629146799145e+17|http://reut.rs/1CArJKC
80|||Thu Apr 02 00:51:20 +0000 2015||Sierra Leone to start laying off Ebola workers as cases fall: president |5.834314849057546e+17|http://reut.rs/1CyU1oW
81|||Thu Apr 02 00:35:34 +0000 2015||Fetal DNA tests prove highly accurate but experts warn of exceptions |5.83427518339928e+17|http://reut.rs/1CyRnzq
82|||Wed Apr 01 22:00:23 +0000 2015||Massive tea consumption linked to kidney failure |5.833884663246152e+17|http://reut.rs/1CypaZw
83|||Wed Apr 01 21:40:12 +0000 2015||Older men who exercise more have better erectile function |5.833833874838364e+17|http://reut.rs/1CykBP1
84|||Wed Apr 01 21:24:21 +0000 2015||Merck, NewLink Ebola vaccine appears safe, effective in new studies |5.833793975472947e+17|http://reut.rs/1xZeGE4
85|||Wed Apr 01 18:55:48 +0000 2015||Obese children may have a harder time tasting fats than leaner kids |5.833420132250255e+17|http://reut.rs/1xYBSSF
86|||Wed Apr 01 15:51:24 +0000 2015||Military suicides aren't linked to deployment, study finds |5.832956055622943e+17|http://reut.rs/1CxdhTJ
87|||Wed Apr 01 12:35:36 +0000 2015||India to repackage state-supplied condoms in bid to attract users |5.83246332275626e+17|http://reut.rs/1CwGyxE
88|||Wed Apr 01 07:04:36 +0000 2015||Five U.S. health workers released after Ebola monitoring in Nebraska |5.831630327145267e+17|http://reut.rs/1xWaip8
89|||Wed Apr 01 00:59:25 +0000 2015||Web searches may predict disease risk among populations |5.830711333496381e+17|http://reut.rs/1CuF4E6
90|||Tue Mar 31 22:42:17 +0000 2015||California getting 'second-hand smog' from Asia, researchers say |5.830366196215767e+17|http://reut.rs/1CuflvN
91|||Tue Mar 31 21:10:06 +0000 2015||RT @ReutersOpinion: This drug, banned in Europe, Russia and China, may be in your lunch:  http://pbs.twimg.com/media/CBdAWUVWkAAubfw.jpg|5.830134207248138e+17|http://reut.rs/1EwZdwZ
92|||Tue Mar 31 20:58:58 +0000 2015||As deadly pig virus wanes, bacon prices shrink |5.830106229562614e+17|http://reut.rs/1xUqRSB
93|||Tue Mar 31 20:43:02 +0000 2015||Constipation emergencies on the rise |5.830066121656238e+17|http://reut.rs/1xUnniV
94|||Tue Mar 31 20:02:14 +0000 2015||New York doctors accused of using free shoes offer to defraud Medicaid |5.829963451132969e+17|http://reut.rs/1xUdO3y
95|||Tue Mar 31 18:20:58 +0000 2015||Air pollution may be tied to anxiety |5.82970859318616e+17|http://reut.rs/1xTRNlk
96|||Tue Mar 31 15:56:58 +0000 2015||New cancer drugs 'vastly overestimated', says contrarian analyst |5.82934619949011e+17|http://reut.rs/1Ct3ii6
97|||Tue Mar 31 15:56:57 +0000 2015||Spain to reinstate primary healthcare for illegal immigrants |5.829346178896404e+17|http://reut.rs/1xTnQlw
98|||Tue Mar 31 15:56:57 +0000 2015||World Bank backs contraception, sexual health in Sahel region |5.829346155827077e+17|http://reut.rs/1Ct3heb
99|||Tue Mar 31 15:56:56 +0000 2015||Pesticides on fruits, veggies linked with poorer semen quality |5.829346136072356e+17|http://reut.rs/1xTnQBK
100|||Tue Mar 31 15:12:01 +0000 2015||Teens with HIV fare worse when parents don't come to clinic appointments |5.829233080747336e+17|http://reut.rs/1CsVPj2
101|||Tue Mar 31 14:54:09 +0000 2015||Guinea finds three Ebola cases in the alumina hub of Fria |5.829188104763802e+17|http://reut.rs/1CsSHDM
102|||Tue Mar 31 14:54:08 +0000 2015||New cancer drugs 'vastly overestimated', says contrarian analyst |5.82918808354046e+17|http://reut.rs/1xTaqWr
103|||Tue Mar 31 13:12:50 +0000 2015||Kenya court urges change to law criminalizing women who pass HIV to baby |5.828933126774129e+17|http://reut.rs/1xSRiIm
104|||Tue Mar 31 11:49:14 +0000 2015||Coalition stopping Red Cross delivering medical aid in Yemen: spokeswoman |5.828722772697825e+17|http://reut.rs/1CsnPDy
105|||Tue Mar 31 11:49:14 +0000 2015||BioCryst Pharma wins federal contract to continue making Ebola drug |5.828722749838868e+17|http://reut.rs/1xSCxFi
106|||Tue Mar 31 10:50:53 +0000 2015||Quintiles, Quest Diagnostics to form clinical trial labs joint venture |5.828575934938112e+17|http://reut.rs/1xSqSq8
107|||Tue Mar 31 05:42:20 +0000 2015||China aims to double doctor numbers as cure for healthcare woes |5.827799439244411e+17|http://reut.rs/1xRuSHj
108|||Tue Mar 31 01:43:34 +0000 2015||Ali Health pens tie-up for online health testing platform |5.827198529321492e+17|http://reut.rs/1Cr0Zfq
109|||Tue Mar 31 00:49:29 +0000 2015||Arizona governor says he has signed abortion bill into law |5.827062458549821e+17|http://reut.rs/1xQGLx3
110|||Tue Mar 31 00:33:40 +0000 2015||One in five teens have tried e-cigarettes, a British study finds |5.827022658757673e+17|http://reut.rs/1xQFc2r
111|||Mon Mar 30 23:32:57 +0000 2015||Pesticides on fruits, veggies linked with poorer semen quality |5.82686985158017e+17|http://reut.rs/1xQyDwN
112|||Mon Mar 30 22:27:57 +0000 2015||J&amp;J, Glaxo settle U.S. lawsuit over allergy ads |5.826706243734897e+17|http://reut.rs/1xQrBIj
113|||Mon Mar 30 20:28:34 +0000 2015||U.S. cancer incidence, mortality largely stable or decreasing |5.826405837112852e+17|http://reut.rs/1CqimNu
114|||Mon Mar 30 18:19:55 +0000 2015||Sierra Leone Ebola lockdown exposes hundreds of suspected cases |5.826082048630538e+17|http://reut.rs/1CpY72v
115|||Mon Mar 30 17:12:21 +0000 2015||Novartis digs deeper into cancer with up to $750 million Aduro deal |5.82591203272704e+17|http://reut.rs/1CpMZCI
116|||Mon Mar 30 16:34:02 +0000 2015||Teva to buy U.S. drug developer Auspex Pharma for $3.5 billion |5.825815619016049e+17|http://reut.rs/1xPBqq0
117|||Mon Mar 30 15:46:51 +0000 2015||Kids’ fast food consumption on the decline |5.825696846938358e+17|http://reut.rs/1CpyXB2
118|||Mon Mar 30 15:33:25 +0000 2015||Apple a day might keep the pharmacist away |5.825663072431677e+17|http://reut.rs/1CpwaYv
119|||Mon Mar 30 15:33:25 +0000 2015||Los Angeles company to halt seafood distribution over listeria: DOJ |5.825663052591923e+17|http://reut.rs/1xPqvwt
120|||Mon Mar 30 14:57:22 +0000 2015||U.S. Ebola patient's status improved to fair from serious: NIH |5.825572342379807e+17|http://reut.rs/1xPiqrq
121|||Mon Mar 30 12:28:39 +0000 2015||GNC Holdings strikes deal with NY Attorney General over herbal supplements |5.825198068234035e+17|http://reut.rs/1xOR5pq
122|||Mon Mar 30 12:28:38 +0000 2015||Feet: the foundation for fitness and health |5.825198050701926e+17|http://reut.rs/1xOR5ps
123|||Mon Mar 30 11:27:56 +0000 2015||Teva to buy U.S. drug developer Auspex Pharma for $3.5 billion |5.825045295241011e+17|http://reut.rs/1IeYiz5
124|||Mon Mar 30 11:12:08 +0000 2015||U.S. plans to dig deeper on antibiotics given to livestock |5.825005520152781e+17|http://reut.rs/1IeSPrS
125|||Mon Mar 30 11:12:08 +0000 2015||BioDelivery Sciences pain drug fails late: stage study |5.825005500775096e+17|http://reut.rs/1xOEeUa
126|||Mon Mar 30 06:14:55 +0000 2015||Sanofi chairman says acquisitions not 'indispensable' for future |5.824257525425848e+17|http://reut.rs/1xO0mhu
127|||Mon Mar 30 04:49:17 +0000 2015||Measure kids’ medicines in metric units, not spoonfuls, doctors say |5.82404204414804e+17|http://reut.rs/1xNSLQb
128|||Mon Mar 30 04:49:17 +0000 2015||Experts caution against random drug testing in schools |5.824042026741514e+17|http://reut.rs/1IddwEw
129|||Sun Mar 29 16:46:38 +0000 2015||Liberia calls for sexual abstinence to cut Ebola transmission risk |5.822223428830577e+17|http://reut.rs/1IaqvHh
130|||Sun Mar 29 15:03:14 +0000 2015||Battlefield lessons transform U.S. emergency care |5.821963240088699e+17|http://reut.rs/1xLoGR0
131|||Sun Mar 29 12:25:34 +0000 2015||Battling nightmare infections: US CDC's plan to beat supberbugs |5.821566451045171e+17|http://reut.rs/1I9oQ4J
132|||Sun Mar 29 11:24:59 +0000 2015||Police fire tear gas on crowd during Sierra Leone Ebola lockdown |5.821413958524641e+17|http://reut.rs/1I9bmGd
133|||Sun Mar 29 09:05:28 +0000 2015||GSK agrees UK deal for meningitis shot after Novartis stand-off |5.821062873428173e+17|http://reut.rs/1xKkfGd
134|||Sat Mar 28 23:33:34 +0000 2015||Guinea president announces new emergency measures in Ebola fight |5.81962365140394e+17|http://reut.rs/1xJATWx
135|||Sat Mar 28 20:55:59 +0000 2015||Police fire tear gas on crowd during Sierra Leone Ebola lockdown |5.8192270545852e+17|http://reut.rs/1xJncqA
136|||Sat Mar 28 17:51:41 +0000 2015||Police fire tear gas on crowd during Sierra Leone Ebola lockdown |5.818763239598612e+17|http://reut.rs/1xJ6HLh
137|||Sat Mar 28 17:22:30 +0000 2015||Minnesota suffers third bird flu infection in commercial poultry |5.818689804298322e+17|http://reut.rs/1I4FceN
138|||Sat Mar 28 00:49:24 +0000 2015||In swansong, FDA chief defends drug approval process |5.816190618696581e+17|http://reut.rs/1xHm9aw
139|||Fri Mar 27 22:43:18 +0000 2015||Liberia's sole remaining known Ebola patient dies |5.815873263437292e+17|http://reut.rs/1xGXXVV
140|||Fri Mar 27 22:09:36 +0000 2015||FDA rejects Adamis Pharma's injection for treating allergic reactions |5.81578846434132e+17|http://reut.rs/1xGQDcT
141|||Fri Mar 27 21:22:21 +0000 2015||USDA hog report confirms active herd growth as pig virus ease |5.815669554480865e+17|http://reut.rs/1xGE9lB
142|||Fri Mar 27 20:48:29 +0000 2015||For disabled vets, playing team sports boosts quality of life |5.815584327901061e+17|http://reut.rs/1HZGZSt
143|||Fri Mar 27 20:48:29 +0000 2015||Vision loss increases risk for thoughts of suicide |5.815584308817101e+17|http://reut.rs/1xGuzz9
144|||Fri Mar 27 17:43:55 +0000 2015||British Ebola patient cured after experimental treatment |5.815119822238802e+17|http://reut.rs/1HYimFG
145|||Fri Mar 27 16:31:46 +0000 2015||Grants help level the playing field for young moms in science |5.814938243478323e+17|http://reut.rs/1HXC6Jy
146|||Fri Mar 27 15:46:45 +0000 2015||Sanofi to launch Toujeo diabetes drug in U.S. on Monday: source |5.814824966861783e+17|http://reut.rs/1xFrjnz
147|||Fri Mar 27 15:15:21 +0000 2015||Eyeliner too close to the eye leads to contamination |5.81474597243093e+17|http://reut.rs/1HWRjKO
148|||Fri Mar 27 15:15:21 +0000 2015||Moms' excess pregnancy weight linked to kids' obesity |5.814745953346724e+17|http://reut.rs/1xFm0o8
149|||Fri Mar 27 13:09:18 +0000 2015||Europe postpones decision on Bristol immune system cancer drug |5.814428725091205e+17|http://reut.rs/1HVG2up
150|||Fri Mar 27 11:41:27 +0000 2015||Ohr Pharma's eye drug fails main goal in mid-stage study |5.814207671010017e+17|http://reut.rs/1xEKApg
151|||Fri Mar 27 11:23:26 +0000 2015||Sierra Leone three-day Ebola lockdown leaves capital 'eerily quiet' |5.814162319006802e+17|http://reut.rs/1HUQPEY
152|||Fri Mar 27 11:23:26 +0000 2015||EU clears German scheme to exempt pharma groups from price freezes |5.814162300888105e+17|http://reut.rs/1xEI423
153|||Fri Mar 27 08:41:27 +0000 2015||Novo Nordisk surges on plan to resubmit rejected insulin in U.S. |5.813754681144566e+17|http://reut.rs/1HTO474
154|||Fri Mar 27 08:41:27 +0000 2015||Senate delays vote on Medicare payment fix for two weeks |5.813754663486464e+17|http://reut.rs/1xEjxuf
155|||Fri Mar 27 00:16:57 +0000 2015||White House crafts first-ever plan to fight superbugs |5.812485069266289e+17|http://reut.rs/1xDcoKp
156|||Thu Mar 26 22:17:44 +0000 2015||White House crafts first-ever plan to fight superbugs |5.812185027422904e+17|http://reut.rs/1xCUU0O
157|||Thu Mar 26 22:04:11 +0000 2015||Two experimental Ebola vaccines pass safety test in African trial |5.812150933728788e+17|http://reut.rs/1HQhTW9
158|||Thu Mar 26 21:32:51 +0000 2015||Widows may have fewer social and financial problems than in the past |5.812072100401152e+17|http://reut.rs/1HQ4IEy
159|||Thu Mar 26 21:32:51 +0000 2015||Exclusive: Modi government puts brakes on India's universal health plan |5.81207207867519e+17|http://reut.rs/1HQ4Kw5
160|||Thu Mar 26 20:14:05 +0000 2015||Occupational exposure to chemicals may up lymphoma risk for men |5.811873861152768e+17|http://reut.rs/1xCzTDD
161|||Thu Mar 26 19:51:40 +0000 2015||FDA to evaluate homeopathy regulatory framework |5.811817452419359e+17|http://reut.rs/1HPmp7i
