|author|contents|date|tags|title|tweetid|url
2284|||Thu Nov 06 09:11:15 +0000 2014||Siemens to create German legal healthcare entity |5.302862779719475e+17|http://reut.rs/1y7HyEX
2285|||Thu Nov 06 01:27:24 +0000 2014||Drugmakers look to push the boundaries of old age |5.301695477271798e+17|http://reut.rs/1Amegrm
2286|||Wed Nov 05 23:23:43 +0000 2014||Colon cancers may be increasing among young adults |5.301384195452682e+17|http://reut.rs/1y5JxcI
2287|||Wed Nov 05 23:23:41 +0000 2014||Caregiver medical leave from work not guaranteed, often unpaid |5.301384135428137e+17|http://reut.rs/1Alx6z5
2288|||Wed Nov 05 22:54:33 +0000 2014||Google to offer Foundation Medicine's cancer tests as latest health benefit |5.301310785653637e+17|http://reut.rs/1AlmoIV
2289|||Wed Nov 05 21:40:13 +0000 2014||Arkansas alternative to Obamacare on critical list after election |5.301123742637752e+17|http://reut.rs/1y5iBK5
2290|||Wed Nov 05 19:49:38 +0000 2014||WHO revises Ebola death toll lower, virus slowing in Liberia |5.300845424395223e+17|http://reut.rs/1y4PQxe
2291|||Wed Nov 05 19:33:57 +0000 2014||Glaxo scientists work to rebuild cancer line-up, funding uncertain |5.3008059584271155e+17|http://reut.rs/1Ak8yGF
2292|||Wed Nov 05 19:18:09 +0000 2014||GSK hepatitis C shot shows promise, bodes well for Ebola vaccines |5.3007662175225446e+17|http://reut.rs/1y4HkhJ
2293|||Wed Nov 05 18:53:21 +0000 2014||Obama seeks $6.2 billion to combat Ebola: officials |5.300703815968031e+17|http://reut.rs/1y4AZmj
2294|||Wed Nov 05 18:53:21 +0000 2014||California hospital explores genetics-aided cancer treatment |5.300703794283192e+17|http://reut.rs/1AjT9WM
2295|||Wed Nov 05 18:30:54 +0000 2014||China to send 1,000 personnel to help fight Ebola: Xinhua |5.3006473046001664e+17|http://reut.rs/1AjKaVz
2296|||Wed Nov 05 18:13:00 +0000 2014||Spanish nurse who survived Ebola offers blood to treat others |5.300602246828196e+17|http://reut.rs/1AjCDWX
2297|||Wed Nov 05 17:45:55 +0000 2014||World Bank brings Ebola funding to nearly $1 billion |5.3005340866616525e+17|http://reut.rs/1y4i4YR
2298|||Wed Nov 05 16:54:00 +0000 2014||German doctors use experimental heart drug in treating Ebola patient |5.3004034361472614e+17|http://reut.rs/1y43bpn
2299|||Wed Nov 05 16:29:14 +0000 2014||Bariatric surgery may alter taste buds, aid weight loss |5.300341122798838e+17|http://reut.rs/1y3W6W2
2300|||Wed Nov 05 16:13:31 +0000 2014||Actavis CEO makes case for the right deal amid Allergan talk |5.3003015692118426e+17|http://reut.rs/1y3RsqX
2301|||Wed Nov 05 15:28:34 +0000 2014||Philippines’ typhoon orphans struggle with trauma a year on |5.300188446022697e+17|http://reut.rs/1y3EXvs
2302|||Wed Nov 05 15:28:33 +0000 2014||Merck says animal food additive Zilmax seen safe in review |5.300188419682468e+17|http://reut.rs/1AixXjY
2303|||Wed Nov 05 13:40:39 +0000 2014||WHO veteran elected as head of Africa office amid Ebola criticism |5.299916856450253e+17|http://reut.rs/1y3dQ3E
2304|||Wed Nov 05 12:19:38 +0000 2014||Exclusive: U.S. Ebola researchers plead for access to virus samples |5.299712961140572e+17|http://reut.rs/1y2UFqH
2305|||Wed Nov 05 06:39:27 +0000 2014||World Bank chief sees mixed progress in West Africa Ebola battle |5.2988568928310886e+17|http://reut.rs/1y1I3QS
2306|||Wed Nov 05 05:00:21 +0000 2014||Australia bows to pressure to step up Ebola fight in Africa |5.2986074908748186e+17|http://reut.rs/1y1oqZ3
2307|||Wed Nov 05 02:36:16 +0000 2014||Legal marijuana gets major test in Oregon, Alaska and D.C. ballots |5.298244899166085e+17|http://reut.rs/1y0RKin
2308|||Tue Nov 04 22:15:11 +0000 2014||Google Glass may obstruct peripheral vision |5.297587857292247e+17|http://reut.rs/1Ad2gIJ
2309|||Tue Nov 04 20:02:15 +0000 2014||Menthol cigarettes no safer than regular tobacco – and maybe riskier |5.297253319521239e+17|http://reut.rs/1AcAPPo
2310|||Tue Nov 04 18:21:00 +0000 2014||Unconditional acceptance may help kids cope with setbacks |5.296998511400755e+17|http://reut.rs/10r1846
2311|||Tue Nov 04 17:25:14 +0000 2014||AstraZeneca's olaparib may also work in prostate cancer: expert |5.296858167556178e+17|http://reut.rs/1xYrFk1
2312|||Tue Nov 04 16:17:11 +0000 2014||Parent-infant communication differs by gender shortly after birth |5.296686908839035e+17|http://reut.rs/1xY7YZt
2313|||Tue Nov 04 15:18:39 +0000 2014||CVS posts slightly higher-than-expected quarterly results |5.2965396110483456e+17|http://reut.rs/1xXQTiq
2314|||Tue Nov 04 15:02:57 +0000 2014||Amgen ovarian cancer drug fails to improve overall survival |5.2965001214244864e+17|http://reut.rs/1Abc31U
2315|||Tue Nov 04 15:02:57 +0000 2014||Exclusive: Shipping lines apply 'Ebola clause' to fend off virus risks |5.296500096971694e+17|http://reut.rs/1xXN0tK
2316|||Tue Nov 04 14:44:14 +0000 2014||Americans strongly back quarantine for Ebola health workers returning to U.S., poll finds:  http://pbs.twimg.com/media/B1mtmHxIMAA-enw.jpg|5.296453017880658e+17|http://reut.rs/1ztXXaC
2317|||Tue Nov 04 13:03:31 +0000 2014||Regeneron cuts top end of eye drug sales forecast |5.296199548582011e+17|http://reut.rs/1AaDsBe
2318|||Tue Nov 04 12:47:54 +0000 2014||Diabetes care, drug-delivery power Becton Dickinson's beat |5.296160227946742e+17|http://reut.rs/1xXd2xe
2319|||Tue Nov 04 12:23:03 +0000 2014||Legal marijuana gets major test in Oregon, Alaska, and D.C. ballots |5.2960976906223616e+17|http://reut.rs/1xX6QFC
2320|||Tue Nov 04 12:23:02 +0000 2014||WHO recommends naloxone to prevent 20,000 overdose deaths in U.S. |5.296097671035208e+17|http://reut.rs/1AasXxP
2321|||Tue Nov 04 11:27:02 +0000 2014||Siemens paves way to hive off healthcare: sources |5.295956717422797e+17|http://reut.rs/1xWUayl
2322|||Tue Nov 04 08:19:59 +0000 2014||AstraZeneca strengthens cancer business with new deals |5.295486015850414e+17|http://reut.rs/1A9o8oy
2323|||Tue Nov 04 06:38:51 +0000 2014||Ebola crisis highlights China's philanthropic shortfall |5.295231474991186e+17|http://reut.rs/1A90GI3
2324|||Tue Nov 04 06:16:15 +0000 2014||Asia must do more to help global Ebola fight: World Bank |5.2951746271985254e+17|http://reut.rs/1xVXKZC
2325|||Tue Nov 04 02:56:06 +0000 2014||Health workers miss Louisiana medical conference over Ebola warning |5.2946709349086e+17|http://reut.rs/1A8b82n
2326|||Tue Nov 04 01:45:42 +0000 2014||U.S. hospital chains see health reform boost to third quarter earnings |5.294493756896215e+17|http://reut.rs/1A7Tgoh
2327|||Tue Nov 04 01:27:49 +0000 2014||Stryker settles hip implants lawsuit |5.2944487545307546e+17|http://reut.rs/1xV22QU
2328|||Tue Nov 04 00:54:02 +0000 2014||U.S. scientists say uncertainties loom about Ebola's transmission, other key facts |5.2943637127942144e+17|http://reut.rs/1A7FXEs
2329|||Tue Nov 04 00:38:11 +0000 2014||Obama to get update on Ebola response from advisers on Tuesday: White House |5.294323839475425e+17|http://reut.rs/1xURb9L
2330|||Tue Nov 04 00:22:40 +0000 2014||Nurse, Maine settle Ebola quarantine suit |5.294284801116856e+17|http://reut.rs/1xUNDEm
2331|||Tue Nov 04 00:22:40 +0000 2014||Americans strongly back quarantine for returning Ebola health workers |5.294284781613261e+17|http://reut.rs/1A7xyRp
2332|||Tue Nov 04 00:07:01 +0000 2014||Canada commits funding for Ebola vaccine research, stockpile |5.294245420083446e+17|http://reut.rs/1xUKbtr
2333|||Mon Nov 03 23:26:10 +0000 2014||Boston Scientific rushed faulty transvaginal mesh to market: lawyer |5.294142602635059e+17|http://reut.rs/1xUApaS
2334|||Mon Nov 03 22:43:28 +0000 2014||Kentucky teacher resigns over forced Ebola scare leave: report |5.294035167551406e+17|http://reut.rs/1A758qI
2335|||Mon Nov 03 22:27:38 +0000 2014||To prevent more kidney stones, drink water |5.2939953176786534e+17|http://reut.rs/1A70toI
2336|||Mon Nov 03 21:31:24 +0000 2014||High triglycerides linked with prostate cancer recurrence |5.2938537705723085e+17|http://reut.rs/1xU8jMI
2337|||Mon Nov 03 21:15:45 +0000 2014||Ebola crisis highlights China's philanthropic shortfall |5.2938144006119424e+17|http://reut.rs/1xU4zea
2338|||Mon Nov 03 20:23:50 +0000 2014||Sanofi says first dengue vaccine may be available in second half of 2015 |5.293683763057828e+17|http://reut.rs/1xTQSMn
2339|||Mon Nov 03 19:14:00 +0000 2014||No increased risk of cancer death with celiac disease |5.293507989843763e+17|http://reut.rs/1A63DZD
2340|||Mon Nov 03 19:13:59 +0000 2014||Air pollution in smokers’ homes can reach outdoor levels in worst cities |5.293507964677939e+17|http://reut.rs/1xTA5Jk
2341|||Mon Nov 03 17:59:48 +0000 2014||Former Adobe exec's start-up seeks to improve the mammogram experience |5.293321261401047e+17|http://reut.rs/1A5FTEZ
2342|||Mon Nov 03 17:32:45 +0000 2014||Thermo Fisher pledges to fix glitch in drug analysis software |5.293253205588746e+17|http://reut.rs/1xTcicG
2343|||Mon Nov 03 16:52:21 +0000 2014||Former Kimberly-Clark healthcare unit makes muted market debut |5.293151542161121e+17|http://reut.rs/1A5jnwf
2344|||Mon Nov 03 16:52:21 +0000 2014||WHO says currently no Ebola cases in Mali, 39 contacts sought |5.29315151888257e+17|http://reut.rs/1xT3dR8
2345|||Mon Nov 03 16:23:00 +0000 2014||Wockhardt says U.S. export ban unlikely to be lifted until next year |5.293077656937759e+17|http://reut.rs/1A5a5QK
2346|||Mon Nov 03 16:22:59 +0000 2014||U.S. nurse who treated Ebola patients, Maine reach deal on monitoring |5.2930776345820774e+17|http://reut.rs/1A5a5QO
2347|||Mon Nov 03 15:58:09 +0000 2014||Melinda Gates backs contraception for healthier, wealthier future |5.29301512598868e+17|http://reut.rs/1xSPREg
2348|||Mon Nov 03 15:35:40 +0000 2014||Fifth Sierra Leone doctor dies after contracting Ebola |5.2929585426046976e+17|http://reut.rs/1xSJMaW
2349|||Mon Nov 03 15:17:51 +0000 2014||U.S. top court leaves intact New York City pregnancy center rule |5.292913724621128e+17|http://reut.rs/1A4NTGn
2350|||Mon Nov 03 15:17:51 +0000 2014||U.S. top court does not act yet on Obamacare subsidies challenge |5.2929137062917325e+17|http://reut.rs/1xSFS1L
2351|||Mon Nov 03 14:44:00 +0000 2014||Halyard Health poised to shine in debut on back of Ebola scare |5.29282852819841e+17|http://reut.rs/1A4DlHc
2352|||Mon Nov 03 13:56:39 +0000 2014||Ebola-carrying bats may be heroes as well as villains |5.29270935300608e+17|http://reut.rs/1A4oc91
2353|||Mon Nov 03 13:56:38 +0000 2014||U.N.'s Ban warns against quarantining Ebola health workers |5.292709331740959e+17|http://reut.rs/1xSmDpe
2354|||Mon Nov 03 11:32:36 +0000 2014||LabCorp to buy Covance for $6.l billion |5.2923468661550285e+17|http://reut.rs/1A3Kesv
2355|||Mon Nov 03 06:10:38 +0000 2014||North Carolina monitoring person who returned from Liberia for Ebola |5.2915365998547354e+17|http://reut.rs/1A2FJOQ
2356|||Mon Nov 03 00:30:37 +0000 2014||U.S. Liberia lab chief tells hip hop-dancing boys they're Ebola-free |5.290680924677407e+17|http://reut.rs/1A1zbjx
2357|||Sun Nov 02 18:41:42 +0000 2014||Maine nurse sees Ebola quarantines as 'abundance of politics' |5.289802830525276e+17|http://reut.rs/1xP7cy3
2358|||Sun Nov 02 10:06:21 +0000 2014||Ebola-carrying bats may be heroes as well as villains |5.288505922997453e+17|http://reut.rs/1xNIJcn
2359|||Sun Nov 02 09:12:01 +0000 2014||U.N. health worker flown to France for Ebola treatment |5.288369180885688e+17|http://reut.rs/1zYng5R
2360|||Sat Nov 01 22:01:34 +0000 2014||Days after waving to U.S. envoy, Liberian boys are Ebola free |5.286681954531656e+17|http://reut.rs/1pfh8le
2361|||Sat Nov 01 16:25:43 +0000 2014||Ebola-free Texas nurse, pet dog reunited after long quarantine |5.28583673986433e+17|http://reut.rs/1xLnM1z
2362|||Sat Nov 01 12:29:20 +0000 2014||Ebola costs encourage budget flexibility among U.S. Republicans |5.2852418798474035e+17|http://reut.rs/1pe0Xog
2363|||Sat Nov 01 00:37:59 +0000 2014||Judge rejects strict limits on nurse who treated Ebola patients |5.2834517055596954e+17|http://reut.rs/1xJfuHC
2364|||Fri Oct 31 22:38:49 +0000 2014||Oregon resident hospitalized for possible Ebola virus infection |5.283151792649175e+17|http://reut.rs/1pcp72E
2365|||Fri Oct 31 22:07:24 +0000 2014||U.S. Medicare sets new hospital, doctor payments for 2015 |5.283072745621709e+17|http://reut.rs/1xJ1v4w
2366|||Fri Oct 31 21:29:12 +0000 2014||Pentagon civilians leaving Ebola zones may choose monitoring regimen |5.282976632096809e+17|http://reut.rs/1xIXehG
2367|||Fri Oct 31 20:59:52 +0000 2014||Halyard Health poised to shine in debut on back of Ebola scare |5.28290279343018e+17|http://reut.rs/1xIUbWG
2368|||Fri Oct 31 20:53:04 +0000 2014||Researchers in Oregon identify autism-risk genes |5.282885689435996e+17|http://reut.rs/1xITsEM
2369|||Fri Oct 31 20:25:48 +0000 2014||Could breathing differently change how people climb mountains? |5.2828170612271104e+17|http://reut.rs/1xIQErr
2370|||Fri Oct 31 20:07:45 +0000 2014||Insurance broker Aon launches Ebola liability cover |5.282771631378432e+17|http://reut.rs/1pbYXgz
2371|||Fri Oct 31 19:52:00 +0000 2014||Canada imposes visa ban on nations where Ebola raging |5.282732013870326e+17|http://reut.rs/1xIMorW
2372|||Fri Oct 31 19:52:00 +0000 2014||Former Adobe exec's start-up seeks to improve the mammogram experience |5.282731987697664e+17|http://reut.rs/1pbVEFW
2373|||Fri Oct 31 18:15:23 +0000 2014||Ebola death toll rises, fewer cases in Guinea than thought: WHO |5.282488874345554e+17|http://reut.rs/1pbDB2A
2374|||Fri Oct 31 16:13:37 +0000 2014||Sleep apnea tied to memory problems |5.282182423605535e+17|http://reut.rs/1xIojl1
2375|||Fri Oct 31 15:30:49 +0000 2014||Conflicts at home affect teens at school and vice versa |5.282074721722286e+17|http://reut.rs/1xIliB5
2376|||Fri Oct 31 15:30:49 +0000 2014||Samantha Power defends Ebola guidelines; praises airlines |5.282074699282555e+17|http://reut.rs/1pbizRN
2377|||Fri Oct 31 15:10:33 +0000 2014||Judge issues order enforcing Ebola isolation of defiant Maine nurse |5.282023708541911e+17|http://reut.rs/1xIk0pS
2378|||Fri Oct 31 14:43:47 +0000 2014|||5.281956338204959e+17|
2379|||Fri Oct 31 14:41:36 +0000 2014|||5.2819508665255526e+17|
2380|||Fri Oct 31 13:36:00 +0000 2014||"RT @ReutersLive: ""The good news is muscle memory is being built now"" -@AmbassadorPower on Ebola response. LIVE:  #Reu…"|5.281785781572403e+17|http://reut.rs/1wQaAMi
2381|||Fri Oct 31 13:24:11 +0000 2014||RT @ReutersLive: .@AmbassadorPower discusses her position on quarantining. LIVE discuss on Ebola:  #ReutersLive|5.2817560198396314e+17|http://reut.rs/1wQ8VWY
2382|||Fri Oct 31 13:08:55 +0000 2014||RT @ReutersLive: Our @SirHarryEvans is now interviewing @AmbassadorPower on the Ebola crisis. Watch LIVE:  #ReutersLi…|5.281717607606559e+17|http://reut.rs/1wQ7vff
2383|||Fri Oct 31 12:53:04 +0000 2014||RT @ReutersLive: Are states overreacting by quarantining people returning from West Africa? Join our LIVE discussion: …|5.2816777365070234e+17|http://t.co/lwgWJUpTx
2384|||Fri Oct 31 12:45:08 +0000 2014||RT @ReutersLive: How difficult is it to contain Ebola once a patient is infected? Join our LIVE discussion. WATCH:  #…|5.2816577757301965e+17|http://reut.rs/107Ehdt
2385|||Fri Oct 31 12:32:39 +0000 2014||RT @ReutersLive: Watch our LIVE panel discussion on the Ebola crisis with @SirHarryEvans. Happening LIVE now:  #Reute…|5.2816263541438464e+17|http://reut.rs/1wNpgKr
2386|||Fri Oct 31 12:30:51 +0000 2014||AbbVie sales blow past forecasts, fueled by Humira |5.2816217972002e+17|http://reut.rs/1paJ2iu
2387|||Fri Oct 31 12:26:51 +0000 2014||RT @ReutersLive: Join us as we discuss the Ebola epidemic with a panel of experts LIVE from @thomsonreuters. Watch here: …|5.281611753310372e+17|http://t.co/zUjZNs
2388|||Fri Oct 31 12:19:31 +0000 2014||WHO says two suspected Ebola cases in Mali, 57 contacts sought |5.281593299505029e+17|http://reut.rs/1paGmRZ
2389|||Fri Oct 31 07:56:07 +0000 2014||India considers ban on e-cigarettes, sale of single smokes |5.280930437744763e+17|http://reut.rs/1xHn0mp
2390|||Fri Oct 31 07:40:20 +0000 2014||JAL worried about potential impact of Ebola on travel market |5.280890699859968e+17|http://reut.rs/1p9P56P
2391|||Fri Oct 31 05:32:05 +0000 2014||New Zealand's Fonterra says China lifts ban on baby formula ingredients |5.28056796515414e+17|http://reut.rs/1xH6NxE
2392|||Fri Oct 31 03:34:52 +0000 2014||U.S. envoy to report temperature twice daily after West Africa visit |5.2802729874293146e+17|http://reut.rs/1xGTQnr
2393|||Fri Oct 31 00:55:15 +0000 2014||U.S. quarantines 'chilling' Ebola fight in West Africa: MSF |5.2798712830807654e+17|http://reut.rs/1p8HKV5
2394|||Fri Oct 31 00:44:00 +0000 2014||Bike-riding nurse defies Ebola quarantine, on collision course with governor |5.27984298801238e+17|http://reut.rs/1p8FDk8
2395|||Thu Oct 30 23:43:19 +0000 2014||U.S. quarantines 'chilling' Ebola fight in West Africa: MSF |5.2796902353197056e+17|http://reut.rs/1xGpaTi
2396|||Thu Oct 30 22:04:26 +0000 2014||Sandwiches may be a source of too much dietary salt |5.2794413847885005e+17|http://reut.rs/1p86SLC
2397|||Thu Oct 30 21:01:25 +0000 2014||FDA panel backs Daiichi's blood thinner |5.2792828065429094e+17|http://reut.rs/1p7P7fz
2398|||Thu Oct 30 20:41:13 +0000 2014||'Wandering eye' may raise risk of falls for older adults |5.27923200093868e+17|http://reut.rs/1xG0NF7
2399|||Thu Oct 30 19:35:45 +0000 2014||Maine governor vows to use full extent of authority on Ebola nurse |5.279067237604475e+17|http://reut.rs/1xFTayL
2400|||Thu Oct 30 19:22:01 +0000 2014||Individual genetic differences may affect Ebola survival: study |5.279032671799992e+17|http://reut.rs/1xFRnJV
2401|||Thu Oct 30 18:50:20 +0000 2014||New York unveils incentives for workers in West Africa Ebola fight |5.2789529507476685e+17|http://reut.rs/1xFOybK
2402|||Thu Oct 30 18:27:56 +0000 2014||To stop Ebola's spread in West Africa, target funerals: study |5.2788965482223616e+17|http://reut.rs/1p7i6A0
2403|||Thu Oct 30 17:53:58 +0000 2014||Speed of weight loss may have little impact on success at keeping it off |5.278811081560883e+17|http://reut.rs/1xFGVCc
2404|||Thu Oct 30 17:22:49 +0000 2014||Insurers have big plans for 2015 Obamacare enrollment |5.278732697778463e+17|http://reut.rs/1xFC57X
2405|||Thu Oct 30 17:22:49 +0000 2014||U.S. attends Ebola meeting in Cuba called by leftist bloc |5.278732678065275e+17|http://reut.rs/1p72zQU
2406|||Thu Oct 30 16:37:34 +0000 2014||U.S. FTC sues Gerber over health claims in baby formula ads |5.278618814455726e+17|http://reut.rs/1p6TqHY
2407|||Thu Oct 30 15:48:59 +0000 2014||RT @ReutersOpinion: We have a strong appetite for fake Ebola news, so what makes rumors so infectious? |5.278496551584481e+17|http://reut.rs/10BhPub
2408|||Thu Oct 30 15:32:30 +0000 2014||Liberians fast, pray for three days to break Ebola 'curse' |5.278455069708288e+17|http://reut.rs/1p6Fmyb
2409|||Thu Oct 30 15:21:21 +0000 2014||Kimberly-Clark faces $500 million lawsuit over Ebola protection gear |5.278427029947187e+17|http://reut.rs/1p6Cl0L
2410|||Thu Oct 30 14:47:21 +0000 2014||Telemedicine eczema care just as effective as office visits |5.2783414421959475e+17|http://reut.rs/1p6wIj9
2411|||Thu Oct 30 14:29:14 +0000 2014||Maine nurse defies state Ebola quarantine, leaves home |5.278295855983493e+17|http://reut.rs/1DCi5oO
2412|||Thu Oct 30 13:57:47 +0000 2014||World Bank funding for Ebola fight hits $500 million |5.2782167205822054e+17|http://reut.rs/1p6n28j
2413|||Thu Oct 30 13:39:42 +0000 2014||Teva optimistic U.S. top court to rule in favor of MS drug patent |5.278171203198116e+17|http://reut.rs/1p6iNty
2414|||Thu Oct 30 13:39:41 +0000 2014||Bristol immunotherapy shows promise in lung cancer trial |5.27817118092628e+17|http://reut.rs/1DC4VIt
2415|||Thu Oct 30 12:09:37 +0000 2014||Novo Nordisk more cautious on timing of U.S. Tresiba launch |5.27794448672256e+17|http://reut.rs/1p5WX9B
2416|||Thu Oct 30 10:28:17 +0000 2014||Fujifilm cautious on Avigan profitability, eyes Ebola spread |5.277689500008694e+17|http://reut.rs/1p5xkWq
2417|||Thu Oct 30 10:28:17 +0000 2014||Bayer says animal health unit large enough |5.2776894797500416e+17|http://reut.rs/1DBe04i
2418|||Thu Oct 30 10:21:30 +0000 2014||In Guangdong, nervy Chinese ramp up Ebola watch |5.27767241279148e+17|http://reut.rs/1DBbStk
2419|||Thu Oct 30 09:54:25 +0000 2014||India's universal healthcare rollout to cost $26 billion: official |5.277604272883753e+17|http://reut.rs/1DB5pyx
2420|||Thu Oct 30 09:54:25 +0000 2014||India's Cipla asks government to revoke Novartis patents on respiratory drug |5.2776042495635046e+17|http://reut.rs/1DB5q5z
2421|||Thu Oct 30 09:54:24 +0000 2014||Bayer says eyeing more deals after bulking up consumer care |5.277604231234232e+17|http://reut.rs/1p5pOKV
2422|||Thu Oct 30 08:15:26 +0000 2014||Saudi Arabia finds six new MERS cases as outbreak grows |5.27735515114922e+17|http://reut.rs/1DAHGP2
2423|||Thu Oct 30 07:25:52 +0000 2014||AstraZeneca wins U.S. approval for two-in-one diabetes pill |5.277230419678331e+17|http://reut.rs/1p4YCfp
2424|||Thu Oct 30 06:07:08 +0000 2014||Microsoft launches wearable fitness device for $199 |5.27703228772012e+17|http://reut.rs/1DAfg7E
2425|||Thu Oct 30 03:54:13 +0000 2014||U.S. agency sues Honeywell over employee wellness testing |5.276697800113152e+17|http://reut.rs/1DzMOmy
2426|||Thu Oct 30 01:00:56 +0000 2014||Global fight against Ebola grows but far from won, U.S. envoy says |5.2762617144674714e+17|http://reut.rs/1p3PCqM
2427|||Thu Oct 30 00:29:23 +0000 2014||Saying she will not be bullied, nurse fights Maine Ebola quarantine |5.2761823110078464e+17|http://reut.rs/1DyXmSJ
2428|||Wed Oct 29 21:51:44 +0000 2014||U.S. agency sues Honeywell over employee wellness testing |5.275785559922565e+17|http://reut.rs/1p3cmar
2429|||Wed Oct 29 21:51:43 +0000 2014||Less than half of doctors in insurance directories may be available |5.275785536811827e+17|http://reut.rs/1DyaffQ
2430|||Wed Oct 29 21:31:25 +0000 2014||People with celiac disease more likely to fracture bones |5.2757344254427955e+17|http://reut.rs/1p37jqs
2431|||Wed Oct 29 21:22:38 +0000 2014||Why do some survive Ebola? Sierra Leone study offers clues |5.2757123133238886e+17|http://reut.rs/1p34RR3
2432|||Wed Oct 29 20:19:24 +0000 2014||Americans may still see some Ebola cases, Obama says |5.27555320403755e+17|http://reut.rs/1DxDpvC
2433|||Wed Oct 29 20:19:24 +0000 2014||Ebola fears ripple across continent to hurt east African tourism |5.2755531842402714e+17|http://reut.rs/1p2Pub3
2434|||Wed Oct 29 19:00:38 +0000 2014||Pfizer meningitis vaccine wins U.S. approval: FDA |5.2753549591681434e+17|http://reut.rs/1p2wJVg
2435|||Wed Oct 29 18:17:57 +0000 2014||Express Scripts says AbbVie drug could displace Sovaldi on formulary |5.2752475635111526e+17|http://reut.rs/1Dx2TJt
2436|||Wed Oct 29 18:17:57 +0000 2014||Experts update stroke prevention guidelines |5.2752475454337434e+17|http://reut.rs/1Dx2TJv
2437|||Wed Oct 29 17:28:30 +0000 2014||U.S. attends Ebola meeting in Cuba called by leftist bloc |5.275123136546857e+17|http://reut.rs/1DwOexV
2438|||Wed Oct 29 17:19:23 +0000 2014||Liberians fast, pray for three days to break Ebola 'curse' |5.275100163547013e+17|http://reut.rs/1p21jOZ
2439|||Wed Oct 29 16:45:35 +0000 2014||Having controlling parents may affect later relationships |5.275015116189901e+17|http://reut.rs/1DwB0RU
2440|||Wed Oct 29 16:30:01 +0000 2014||Maine, nurse who tested negative for Ebola clash over quaratine |5.274975942648832e+17|http://reut.rs/1p1P19h
2441|||Wed Oct 29 15:26:53 +0000 2014||Hagel accepts strict monitoring of U.S. troops returning from Ebola mission |5.274817040057631e+17|http://reut.rs/1p1xkXt
2442|||Wed Oct 29 14:59:52 +0000 2014||As debate rages, GMO labeling votes loom in Oregon, Colorado |5.274749055045509e+17|http://reut.rs/1p1rKnX
2443|||Wed Oct 29 14:28:19 +0000 2014||Ebola appears to be slowing in Liberia: WHO |5.274669688537989e+17|http://reut.rs/1DvWZZa
2444|||Wed Oct 29 14:21:33 +0000 2014||Canadian Ebola vaccine to be tested in Europe, Gabon, Kenya |5.274652627871007e+17|http://reut.rs/1DvUYMC
2445|||Wed Oct 29 13:27:24 +0000 2014||Lilly, Boehringer revise terms of diabetes drugs alliance |5.274516360344453e+17|http://reut.rs/1DvFxUD
2446|||Wed Oct 29 12:53:48 +0000 2014||Behind the scenes of Sanofi's boardroom bust up |5.27443183144534e+17|http://reut.rs/1p0Pokm
2447|||Wed Oct 29 11:59:47 +0000 2014||U.S. nurse threatens court actions over Maine quarantine on Ebola fears: NBC |5.2742958830638285e+17|http://reut.rs/1p0zpmp
2448|||Wed Oct 29 10:52:13 +0000 2014||Beijing recommends home quarantine for people coming from Ebola regions |5.274125840946381e+17|http://reut.rs/1p0fSCq
2449|||Wed Oct 29 10:07:16 +0000 2014||Experts sound alarm as diabetes fuels cases of TB |5.274012712850227e+17|http://reut.rs/1p03lPn
2450|||Wed Oct 29 08:52:46 +0000 2014||UK charities group launches appeal for Ebola, first for a disease |5.273825245329162e+17|http://reut.rs/1oZJhwK
2451|||Wed Oct 29 06:53:31 +0000 2014||Australian Ebola 'tsar' questions government's West Africa visa ban |5.273525125219656e+17|http://reut.rs/1DtZtY3
2452|||Wed Oct 29 00:58:04 +0000 2014||Obama defends U.S. Ebola guidelines, backs American volunteers in Africa |5.2726306152330445e+17|http://reut.rs/1oXX6vx
2453|||Wed Oct 29 00:22:09 +0000 2014||Smiles, movies cheer Ebola patients in Liberian bush unit |5.272540219928863e+17|http://reut.rs/1DsIJR0
2454|||Tue Oct 28 23:39:12 +0000 2014||In Ebola response, Obama's 'czar' stays behind the curtain |5.272432150037176e+17|http://reut.rs/1DszfoN
2455|||Tue Oct 28 23:39:12 +0000 2014||Nurse released after Ebola treatment: 'I'm so grateful to be well' |5.2724321219772416e+17|http://reut.rs/1oXEig3
2456|||Tue Oct 28 22:58:58 +0000 2014||U.S. files civil charges against NY drug treatment nonprofit following arrests |5.272330885613609e+17|http://reut.rs/1oXvmak
2457|||Tue Oct 28 22:18:11 +0000 2014||U.S. airlines point to additional problems of any Ebola travel ban |5.2722282377406054e+17|http://reut.rs/1Dsg6Dk
2458|||Tue Oct 28 22:18:10 +0000 2014||Fewer teens drink at parties in communities with ‘social host’ laws |5.2722282180275814e+17|http://reut.rs/1oXksSb
